GCF_005144965.1_ASM514496v1_genomic.fna	3	0	0	0	0	0	0	0	1	1	0	1	0	0	0	0	0	NZ_CP039704.1 Hankyongella ginsenosidimutans strain W1-2-3 chromosome, complete genome [1 total record]
GCF_014643415.1_ASM1464341v1_genomic.fna	3	0	0	0	0	0	0	0	0	0	0	2	0	0	1	0	0	NZ_BMJK01000001.1 Aurantiacibacter arachoides strain CGMCC 1.15507 sequence1, whole genome shotgun sequence [2 total records]
GCF_001889025.1_ASM188902v1_genomic.fna	2	0	0	0	0	0	0	0	0	0	0	1	0	0	1	0	0	NZ_CP018154.1 Sphingorhabdus lutea strain LPB0140 chromosome, complete genome [1 total record]
GCF_007280415.1_ASM728041v1_genomic.fna	2	0	0	0	0	0	0	0	0	0	0	2	0	0	0	0	0	NZ_VKKU01000001.1 Sphingorhabdus contaminans strain KCTC32445 NODE_1_length_1691790_cov_141.238532, whole genome shotgun sequence [2 total records]
GCF_009827635.1_ASM982763v1_genomic.fna	3	0	0	0	0	0	0	0	0	0	0	3	0	0	0	0	0	NZ_WTYW01000001.1 Parapontixanthobacter aurantiacus strain MCCC 1A09962 NODE_1_length_1686974, whole genome shotgun sequence [7 total records]
GCF_028595285.1_ASM2859528v1_genomic.fna	2	0	0	0	0	0	0	0	0	0	0	1	0	0	1	0	0	NZ_JAQQXQ010000001.1 Erythrobacter fulvus strain sf7 contig1, whole genome shotgun sequence [20 total records]
GCF_000013325.1_ASM1332v1_genomic.fna	3	0	0	0	0	0	0	1	0	0	0	1	0	0	1	0	0	NC_007794.1 Novosphingobium aromaticivorans DSM 12444, complete sequence [3 total records]
GCF_002155425.1_ASM215542v1_genomic.fna	2	0	0	0	0	0	0	0	0	0	0	1	0	0	1	0	0	NZ_MUYG01000002.1 Erythrobacter donghaensis strain DSM 16220 DSM16220_10_5145, whole genome shotgun sequence [11 total records]
GCF_002251755.1_ASM225175v1_genomic.fna	2	0	0	0	1	0	0	0	0	0	0	1	0	0	0	0	0	NZ_NOXT01000032.1 Sandarakinorhabdus cyanobacteriorum strain TH057 C7377, whole genome shotgun sequence [129 total records]
GCF_002796605.1_ASM279660v1_genomic.fna	4	0	0	0	0	0	0	0	0	1	0	2	0	0	1	0	0	NZ_CP024923.1 Sphingomonas psychrotolerans strain Cra20 chromosome, complete genome [2 total records]
GCF_009827455.1_ASM982745v1_genomic.fna	2	0	0	0	0	0	0	0	0	0	0	1	0	0	1	0	0	NZ_WTYZ01000001.1 Pontixanthobacter aestiaquae strain KCTC 42006 NODE_1_length_2859684_, whole genome shotgun sequence [2 total records]
GCF_014199685.1_ASM1419968v1_genomic.fna	2	0	0	0	1	0	0	0	0	0	0	0	0	0	1	0	0	NZ_JACHNZ010000001.1 Sphingosinicella soli strain DSM 17328 Ga0373316_01, whole genome shotgun sequence [95 total records]
GCF_039555325.1_ASM3955532v1_genomic.fna	1	0	0	0	0	0	0	0	0	0	0	1	0	0	0	0	0	NZ_CP154608.1 Sphingomicrobium maritimum strain XHP0239 chromosome [1 total record]
GCF_008692605.1_ASM869260v1_genomic.fna	8	0	0	1	0	0	0	1	1	0	0	4	0	0	1	0	0	NZ_LFCT01000001.1 Sphingobium estronivorans strain AXB contig1, whole genome shotgun sequence [63 total records]
GCF_007859635.1_ASM785963v1_genomic.fna	2	0	0	0	0	0	0	0	0	0	0	1	0	0	1	0	0	NZ_CP042306.1 Sphingomonas panacisoli strain HKS19 chromosome, complete genome [1 total record]
GCF_003967075.1_ASM396707v1_genomic.fna	2	0	0	0	0	0	0	0	0	0	0	1	0	0	1	0	0	NZ_AP018664.1 Sphingobium amiense strain DSM 16289 chromosome, complete genome [7 total records]
GCF_039652585.1_ASM3965258v1_genomic.fna	3	0	0	0	0	0	0	0	0	0	0	2	0	0	1	0	0	NZ_JBDIZK010000001.1 Sphingomonas rustica strain HF-S3 contig1, whole genome shotgun sequence [27 total records]
GCF_003550065.1_ASM355006v1_genomic.fna	1	0	0	0	0	0	0	0	0	0	0	0	0	0	1	0	0	NZ_QXDC01000002.1 Hephaestia caeni strain DSM 25527 Ga0244559_101, whole genome shotgun sequence [10 total records]
GCF_019930585.1_ASM1993058v1_genomic.fna	1	0	0	0	0	0	0	0	0	0	1	0	0	0	0	0	0	NZ_CP082839.1 Sphingomonas nostoxanthinifaciens strain AK-PDB1-5 chromosome, complete genome [1 total record]
GCF_003590775.1_ASM359077v1_genomic.fna	5	0	0	0	0	0	0	0	0	0	0	3	1	0	1	0	0	NZ_QYUM01000001.1 Sphingomonas cavernae strain K2R01-6 Segkk0, whole genome shotgun sequence [5 total records]
GCF_004208535.1_ASM420853v1_genomic.fna	5	0	0	0	0	0	0	0	0	0	0	3	0	0	1	1	0	NZ_SGIS01000001.1 Sphingomonas populi strain 3-7 Scaffold1, whole genome shotgun sequence [156 total records]
GCF_001598335.1_ASM159833v1_genomic.fna	2	0	0	0	0	0	0	0	0	0	0	0	1	0	1	0	0	NZ_BCYT01000001.1 Sphingobium abikonense NBRC 16140, whole genome shotgun sequence [45 total records]
GCF_014203955.1_ASM1420395v1_genomic.fna	3	0	0	0	0	0	0	0	0	0	0	2	0	0	1	0	0	NZ_JACHKA010000001.1 Sphingobium lignivorans strain B1D3A Ga0417167_01, whole genome shotgun sequence [1 total record]
GCF_012516475.1_ASM1251647v1_genomic.fna	3	0	0	0	0	0	0	0	0	0	0	2	0	0	1	0	0	NZ_CP051217.1 Parasphingorhabdus halotolerans strain JK6 chromosome, complete genome [1 total record]
GCF_037154155.1_ASM3715415v1_genomic.fna	2	0	0	0	0	0	0	0	0	0	0	1	0	0	1	0	0	NZ_JBANRN010000001.1 Altererythrobacter lauratis strain Y-8 NODE_1_length_487026_cov_243.845756, whole genome shotgun sequence [32 total records]
GCF_003584015.1_ASM358401v1_genomic.fna	3	0	0	0	0	0	0	0	0	0	0	2	0	0	1	0	0	NZ_QXFM01000003.1 Aurantiacibacter xanthus strain CCTCC AB 2015396 10, whole genome shotgun sequence [137 total records]
GCF_003815535.1_ASM381553v1_genomic.fna	4	0	0	0	0	0	0	0	0	0	1	3	0	0	0	0	0	NZ_RPFZ01000001.1 Aurantiacibacter spongiae strain HN-E23 contig1, whole genome shotgun sequence [2 total records]
GCF_003499275.1_ASM349927v1_genomic.fna	2	0	0	0	0	0	0	0	0	0	0	2	0	0	0	0	0	NZ_QWDF01000001.1 Sphingomonas mesophila strain SYSUP0001 SYSUP0001_Contig1, whole genome shotgun sequence [2 total records]
GCF_018982885.2_ASM1898288v2_genomic.fna	3	0	0	0	0	0	0	0	0	0	0	2	1	0	0	0	0	NZ_CP081848.1 Polymorphobacter megasporae strain PAMC 29362 chromosome, complete genome [3 total records]
GCF_016019885.1_ASM1601988v1_genomic.fna	3	0	0	0	0	0	0	0	0	0	0	1	1	0	1	0	0	NZ_JAEANY010000001.1 Aurantiacibacter sediminis strain JGD-13 NODE_1_length_1080203_cov_40.937514, whole genome shotgun sequence [4 total records]
GCF_016427505.1_ASM1642750v1_genomic.fna	3	0	0	0	0	0	0	1	0	0	0	2	0	0	0	0	0	NZ_JAELXS010000010.1 Sphingomonas mollis strain BT553 NODE_10_length_111167_cov_55.854829, whole genome shotgun sequence [24 total records]
GCF_002870965.1_ASM287096v1_genomic.fna	2	0	0	0	0	0	0	0	0	0	0	1	0	0	1	0	0	NZ_PHSO01000001.1 Tsuneonella flava strain MS1-4 contig1, whole genome shotgun sequence [17 total records]
GCF_015865035.1_ASM1586503v1_genomic.fna	6	0	0	0	0	0	0	0	1	0	0	3	1	0	1	0	0	NZ_JADZGI010000010.1 Novosphingobium aureum strain YJ-S2-02 NODE_10_length_35585_cov_88.136359, whole genome shotgun sequence [18 total records]
GCF_010450875.1_ASM1045087v1_genomic.fna	3	0	0	0	0	0	0	0	0	0	0	2	0	0	1	0	0	NZ_CP048422.1 Sphingomonas insulae strain KCTC 12872 chromosome, complete genome [5 total records]
GCF_009768975.1_ASM976897v1_genomic.fna	4	0	0	0	0	0	0	0	0	0	0	3	1	0	0	0	0	NZ_CP035733.1 Sphingorhabdus lacus strain IMCC1753 chromosome [1 total record]
GCF_014640675.1_ASM1464067v1_genomic.fna	4	0	0	0	0	0	0	0	0	0	1	2	0	0	1	0	0	NZ_BMHK01000001.1 Novosphingobium endophyticum strain CGMCC 1.15095 sequence001, whole genome shotgun sequence [96 total records]
GCF_011762085.1_ASM1176208v1_genomic.fna	3	0	0	0	0	0	0	0	0	1	0	1	0	0	1	0	0	NZ_JAASQP010000001.1 Sphingomonas japonica strain DSM 22753 Ga0373327_01, whole genome shotgun sequence [1 total record]
GCF_038148795.1_ASM3814879v1_genomic.fna	1	0	0	0	0	0	0	0	0	0	0	1	0	0	0	0	0	NZ_JBAPEU010000001.1 Sphingomonas agri strain LMG 29563 NODE_1_length_1341431_cov_228.627709, whole genome shotgun sequence [4 total records]
GCF_004135605.1_ASM413560v1_genomic.fna	5	0	0	0	0	0	0	0	1	0	0	2	0	0	1	1	0	NZ_SDPT01000001.1 Sphingomonas desiccabilis strain CP1D NODE_1_length_1757769_cov_65.773517, whole genome shotgun sequence [5 total records]
GCF_003034225.1_ASM303422v1_genomic.fna	1	0	0	0	0	0	0	0	0	0	0	1	0	0	0	0	0	NZ_PHHF01000055.1 Sphingomonas fennica strain K101 C385, whole genome shotgun sequence [89 total records]
GCF_013260645.1_ASM1326064v1_genomic.fna	1	0	0	0	0	0	0	0	0	0	0	1	0	0	0	0	0	NZ_CP053921.1 Erythrobacter mangrovi strain EB310 chromosome, complete genome [1 total record]
GCF_039536725.1_ASM3953672v1_genomic.fna	2	0	0	0	0	0	0	0	0	0	0	2	0	0	0	0	0	NZ_BAAAZD010000001.1 Sphingomonas humi strain JCM 16603 sequence1, whole genome shotgun sequence [3 total records]
GCF_029623755.1_ASM2962375v1_genomic.fna	3	0	0	0	0	0	0	0	0	0	0	2	0	0	1	0	0	NZ_CP121106.1 Altererythrobacter arenosus strain CAU 1644 chromosome [1 total record]
GCF_900182875.1_IMG-taxon_2706794921_annotated_assembly_genomic.fna	3	0	0	0	0	0	0	0	0	0	0	2	0	0	1	0	0	NZ_FXUI01000001.1 Novosphingobium panipatense strain SM16 Ga0138999_101, whole genome shotgun sequence [63 total records]
GCF_039537815.1_ASM3953781v1_genomic.fna	3	0	0	0	0	0	0	1	0	0	0	2	0	0	0	0	0	NZ_BAABBF010000001.1 Sphingomonas cynarae strain JCM 17498 sequence01, whole genome shotgun sequence [23 total records]
GCF_007995065.1_ASM799506v1_genomic.fna	3	0	0	0	0	0	0	0	0	0	0	2	0	0	1	0	0	NZ_VOQR01000001.1 Sphingomonas ginsenosidivorax strain KHI67, whole genome shotgun sequence [2 total records]
GCF_009827295.1_ASM982729v1_genomic.fna	3	0	0	0	0	0	0	0	0	0	0	2	0	0	1	0	0	NZ_WTYD01000001.1 Qipengyuania pelagi strain JCM 17468 JCM17468_1, whole genome shotgun sequence [9 total records]
GCF_000429005.1_ASM42900v1_genomic.fna	2	0	0	0	0	0	0	0	0	0	1	0	0	0	1	0	0	NZ_AUBA01000001.1 Novosphingobium acidiphilum DSM 19966 G404DRAFT_scaffold00001.1_C, whole genome shotgun sequence [54 total records]
GCF_009755805.1_ASM975580v1_genomic.fna	3	0	0	0	0	0	0	0	0	0	0	2	0	0	1	0	0	NZ_WRPJ01000024.1 Sphingomonas prati strain W18RD NODE_1047_length_1647_cov_213.85321_cov_213.853211, whole genome shotgun sequence [29 total records]
GCF_042678385.1_ASM4267838v1_genomic.fna	2	0	0	0	0	0	0	0	0	0	0	2	0	0	0	0	0	NZ_JBHUDY010000001.1 Sphingomonas tabacisoli strain CGMCC 1.16275 soapdenovo_K_61_1, whole genome shotgun sequence [4 total records]
GCF_023935825.1_ASM2393582v1_genomic.fna	5	0	0	0	0	0	0	1	0	0	0	3	0	0	1	0	0	NZ_CP098762.1 Sphingomonas aerolata strain PDD-32b-11 chromosome, complete genome [4 total records]
GCF_900110035.1_IMG-taxon_2654588200_annotated_assembly_genomic.fna	3	0	0	0	0	0	0	0	0	0	0	2	0	0	1	0	0	NZ_FOCF01000020.1 Sphingomonas gellani strain S6-262, whole genome shotgun sequence [20 total records]
GCF_030271515.1_ASM3027151v1_genomic.fna	3	0	0	0	0	0	0	0	1	0	0	1	0	0	1	0	0	NZ_JASCXI010000001.1 Erythrobacter oryzae strain COR-2 COR-2.00001, whole genome shotgun sequence [7 total records]
GCF_012979275.1_ASM1297927v1_genomic.fna	2	0	0	0	0	0	0	0	0	0	0	1	0	0	1	0	0	NZ_JABASZ010000002.1 Pseudopontixanthobacter vadosimaris strain JL3514 NODE_10_length_97824_cov_115.452_ID_19, whole genome shotgun sequence [39 total records]
GCF_000412635.1_Sphingobium_sp._strain_YL23_genomic.fna	6	0	0	0	0	0	0	0	1	1	0	3	0	0	1	0	0	NZ_ASTG01000001.1 Sphingobium bisphenolivorans strain YL23 contig001, whole genome shotgun sequence [56 total records]
GCF_019204045.1_ASM1920404v1_genomic.fna	3	0	0	0	0	0	0	0	0	0	0	2	0	0	1	0	0	NZ_JAGSPC010000001.1 Erythrobacter crassostrea strain WH158 1, whole genome shotgun sequence [6 total records]
GCF_019880555.1_ASM1988055v1_genomic.fna	5	0	0	0	0	0	0	0	0	0	1	2	1	0	1	0	0	NZ_JAINVU010000010.1 Hephaestia mangrovi strain CMS5P-6 Scaffold10_1, whole genome shotgun sequence [22 total records]
GCF_045291475.1_ASM4529147v1_genomic.fna	4	0	0	0	0	0	0	0	0	0	0	3	0	0	1	0	0	NZ_CP147985.1 Parerythrobacter aurantius strain 1C24 chromosome [1 total record]
GCF_013378075.1_ASM1337807v1_genomic.fna	1	0	0	0	0	0	0	0	0	0	0	0	0	0	1	0	0	NZ_CP051131.1 Parasphingopyxis algicola strain JCM 31719 chromosome, complete genome [1 total record]
GCF_014636175.1_ASM1463617v1_genomic.fna	2	0	0	0	0	0	0	0	0	0	0	1	0	0	1	0	0	NZ_BMDW01000001.1 Sphingomonas psychrolutea strain CGMCC 1.10106 sequence01, whole genome shotgun sequence [52 total records]
GCF_001598415.1_ASM159841v1_genomic.fna	5	0	0	0	0	0	0	0	0	0	0	4	0	0	1	0	0	NZ_BCYX01000001.1 Sphingomonas mali NBRC 15500, whole genome shotgun sequence [104 total records]
GCF_000715015.1_Ery_DSM_6997_v1_genomic.fna	2	0	0	0	0	0	0	0	0	0	0	1	0	0	1	0	0	NZ_JMIW01000001.1 Erythrobacter longus strain DSM 6997 contig1, whole genome shotgun sequence [14 total records]
GCF_019880585.1_ASM1988058v1_genomic.fna	3	0	0	0	0	0	0	0	0	0	0	1	0	0	1	1	0	NZ_JAINVV010000015.1 Sphingomonas colocasiae strain JCM 31229 Scaffold10_1, whole genome shotgun sequence [23 total records]
GCF_001590985.1_ASM159098v1_genomic.fna	3	0	0	0	0	0	0	0	1	0	1	1	0	0	0	0	0	NZ_BCTX01000001.1 Novosphingobium naphthalenivorans NBRC 102051, whole genome shotgun sequence [208 total records]
GCF_002374835.1_ASM237483v1_genomic.fna	2	0	0	0	0	0	0	0	0	0	1	1	0	0	0	0	0	NZ_NWVD01000001.1 Sphingomonas ginsenosidimutans strain KACC 14949 contig1, whole genome shotgun sequence [49 total records]
GCF_004005485.1_ASM400548v1_genomic.fna	2	0	0	0	0	0	0	0	0	0	0	1	0	0	1	0	0	NZ_RZUL01000010.1 Sphingobium algorifonticola strain TLA-22 NODE_10_length_47719_cov_88, whole genome shotgun sequence [33 total records]
GCF_033956045.1_ASM3395604v1_genomic.fna	2	0	0	0	0	0	0	0	0	0	0	1	0	0	1	0	0	NZ_CP138853.1 Qipengyuania profunda strain HL-TH5 chromosome, complete genome [2 total records]
GCF_001008165.2_ASM100816v2_genomic.fna	3	0	0	0	0	0	0	0	0	0	0	2	0	0	1	0	0	NZ_CP011452.2 Croceibacterium atlanticum strain 26DY36 chromosome, complete genome [2 total records]
GCF_026157185.1_ASM2615718v1_genomic.fna	1	0	0	0	0	0	0	0	0	0	0	0	1	0	0	0	0	NZ_JANPVP010000001.1 Sphingomicrobium lutaoense strain DSM 24194 NODE_1_length_1612694_cov_320.240225, whole genome shotgun sequence [2 total records]
GCF_015529805.1_ASM1552980v1_genomic.fna	5	0	0	0	0	0	0	0	0	1	0	3	0	0	1	0	0	NZ_CP064654.1 Qipengyuania soli strain 6D36 chromosome [1 total record]
GCF_018417475.1_ASM1841747v1_genomic.fna	6	0	0	0	0	0	0	0	1	0	0	3	0	0	1	1	0	NZ_CP054856.1 Novosphingobium decolorationis strain 502str22 chromosome, complete genome [2 total records]
GCF_009827445.1_ASM982744v1_genomic.fna	3	0	0	0	0	0	0	0	0	0	0	2	0	0	1	0	0	NZ_WTYI01000001.1 Qipengyuania aquimaris strain JCM 12189 NODE_1_length_2662510, whole genome shotgun sequence [1 total record]
GCF_900177715.1_IMG-taxon_2718218510_annotated_assembly_genomic.fna	3	0	0	0	0	0	0	0	0	0	0	2	0	0	1	0	0	NZ_FXWG01000005.1 Altererythrobacter xiamenensis strain CGMCC 1.12494, whole genome shotgun sequence [5 total records]
GCF_032852305.1_ASM3285230v1_genomic.fna	2	0	0	0	0	0	0	0	0	0	0	1	0	0	1	0	0	NZ_CP136594.1 Alterisphingorhabdus coralli strain SCSIO 66989 chromosome, complete genome [2 total records]
GCF_003431825.1_ASM343182v1_genomic.fna	2	0	0	0	0	0	0	0	1	0	0	1	0	0	0	0	0	NZ_CP020083.1 Blastomonas fulva strain T2 chromosome, complete genome [2 total records]
GCF_023516455.1_ASM2351645v1_genomic.fna	1	0	0	0	0	0	0	0	0	0	0	1	0	0	0	0	0	NZ_JAMGBA010000001.1 Sphingomonas caseinilyticus strain NSE70-1 1, whole genome shotgun sequence [5 total records]
GCF_003605195.1_ASM360519v1_genomic.fna	3	0	0	0	0	0	0	0	0	0	0	2	0	0	1	0	0	NZ_QYOS01000016.1 Aurantiacibacter odishensis strain KCTC 23981 KCTC23981_10_54888, whole genome shotgun sequence [25 total records]
GCF_014196595.1_ASM1419659v1_genomic.fna	1	0	0	0	0	0	0	0	0	0	0	1	0	0	0	0	0	NZ_JACIEA010000001.1 Sphingorhabdus rigui strain DSM 29050 Ga0373249_01, whole genome shotgun sequence [8 total records]
GCF_014197135.1_ASM1419713v1_genomic.fna	4	0	0	0	0	0	0	0	0	0	0	3	0	0	1	0	0	NZ_JACIFA010000001.1 Sphingomonas zeae strain DSM 100049 Ga0373351_01, whole genome shotgun sequence [44 total records]
GCF_003660445.1_ASM366044v1_genomic.fna	5	0	0	0	0	0	1	0	0	0	0	4	0	0	0	0	0	NZ_QZVQ01000001.1 Croceibacterium ferulae strain SX2RGS8 contig001, whole genome shotgun sequence [32 total records]
GCF_037076535.1_ASM3707653v1_genomic.fna	3	0	0	0	0	0	0	0	0	0	0	2	0	0	1	0	0	NZ_AP029021.1 Novosphingobium olei strain DW067 chromosome, complete genome [1 total record]
GCF_040813635.1_ASM4081363v1_genomic.fna	3	0	0	0	0	0	0	0	0	0	0	1	1	0	1	0	0	NZ_JBFNXR010000001.1 Novosphingobium rhizovicinum strain M1R2S20 14, whole genome shotgun sequence [54 total records]
GCF_017498565.1_ASM1749856v1_genomic.fna	4	0	0	0	0	0	0	0	0	0	0	3	0	0	1	0	0	NZ_CP071794.1 Parasphingorhabdus cellanae strain JHSY0214 chromosome, complete genome [1 total record]
GCF_000722875.1_Schl_MUMv1_genomic.fna	6	0	0	0	1	0	0	1	0	0	0	3	0	0	1	0	0	NZ_JFHR01000001.1 Sphingobium chlorophenolicum strain NBRC 16172 contig000001, whole genome shotgun sequence [121 total records]
GCF_000803645.1_ASM80364v1_genomic.fna	5	0	0	0	0	0	0	0	0	0	0	4	0	0	1	0	0	NZ_CP009122.1 Sphingopyxis fribergensis strain Kp5.2 chromosome, complete genome [2 total records]
GCF_007004095.1_ASM700409v1_genomic.fna	3	0	0	0	0	0	0	0	0	0	0	2	0	0	1	0	0	NZ_VHJK01000001.1 Erythrobacter insulae strain JBTF-M21 contig1, whole genome shotgun sequence [2 total records]
GCF_019429535.1_ASM1942953v1_genomic.fna	3	0	0	0	0	0	0	0	0	0	0	2	0	0	1	0	0	NZ_JAHXZM010000010.1 Sphingomonas citricola strain RHCKR47 NODE_10_length_50292_cov_108.383096, whole genome shotgun sequence [11 total records]
GCF_002351485.1_ASM235148v1_genomic.fna	3	0	0	0	0	0	0	0	1	0	1	1	0	0	0	0	0	NZ_NWMW01000001.1 Sphingomonas spermidinifaciens strain 9NM-10 contig1, whole genome shotgun sequence [5 total records]
GCF_014199625.1_ASM1419962v1_genomic.fna	1	0	0	0	0	0	0	0	0	0	0	1	0	0	0	0	0	NZ_JACHNY010000001.1 Sphingomonas abaci strain DSM 15867 Ga0373314_01, whole genome shotgun sequence [42 total records]
GCF_031846435.1_ASM3184643v1_genomic.fna	1	0	0	0	0	0	0	0	0	0	0	1	0	0	0	0	0	NZ_JAVRHS010000001.1 Croceicoccus esteveae strain F390 1, whole genome shotgun sequence [27 total records]
GCF_026168555.2_ASM2616855v2_genomic.fna	3	0	0	0	0	0	0	0	0	0	0	2	0	0	1	0	0	NZ_CP092471.1 Qipengyuania spongiae strain PHS-Z21 chromosome, complete genome [2 total records]
GCF_014197035.1_ASM1419703v1_genomic.fna	6	0	0	0	0	0	0	0	0	0	0	4	0	0	1	1	0	NZ_JACIEU010000001.1 Sphingobium scionense strain DSM 19371 Ga0373320_001, whole genome shotgun sequence [102 total records]
GCF_011044255.1_ASM1104425v1_genomic.fna	4	0	0	0	0	0	0	0	0	0	1	2	1	0	0	0	0	NZ_CP049107.1 Rhizorhabdus phycosphaerae strain MK52 chromosome, complete genome [1 total record]
GCF_014199255.1_ASM1419925v1_genomic.fna	5	0	0	0	0	0	0	0	0	0	0	3	1	0	1	0	0	NZ_JACIJF010000001.1 Sphingomonas xinjiangensis strain DSM 26736 Ga0373338_01, whole genome shotgun sequence [64 total records]
GCF_001046645.1_S.czeLL01_genomic.fna	3	0	0	0	0	0	0	0	1	0	0	1	0	0	1	0	0	NZ_KQ130434.1 Sphingobium cupriresistens LL01 25410_scaffold_01, whole genome shotgun sequence [18 total records]
GCF_003171655.1_ASM317165v1_genomic.fna	3	0	0	0	0	0	0	0	0	1	0	1	0	0	1	0	0	NZ_QFZL01000010.1 Sphingosinithalassobacter portus strain FM6 Scaffold10_1, whole genome shotgun sequence [17 total records]
GCF_004796535.1_ASM479653v1_genomic.fna	3	0	0	0	0	0	0	0	0	0	0	2	0	0	1	0	0	NZ_SPHY01000001.1 Sphingomonas flavalba strain ZLT-5 Scaffold1, whole genome shotgun sequence [33 total records]
GCF_033842725.1_ASM3384272v1_genomic.fna	2	0	0	0	0	0	0	0	0	0	0	1	0	0	1	0	0	NZ_JAWXXV010000001.1 Sphingomonas echinoides strain ATCC 14820 contig_1_polypolish, whole genome shotgun sequence [3 total records]
GCF_000802385.1_ASM80238v1_genomic.fna	3	0	0	0	0	0	1	0	0	0	0	2	0	0	0	0	0	NZ_JTDN01000001.1 Croceibacterium mercuriale strain Coronado scaffold_0, whole genome shotgun sequence [7 total records]
GCF_002374855.1_ASM237485v1_genomic.fna	3	0	0	0	0	0	0	0	0	0	1	2	0	0	0	0	0	NZ_NWVC01000001.1 Sphingomonas adhaesiva strain DSM 7418 contig1, whole genome shotgun sequence [36 total records]
GCF_000585415.1_ASM58541v1_genomic.fna	1	0	0	0	0	0	0	0	0	0	0	1	0	0	0	0	0	NZ_KK073876.1 Sphingomonas jaspsi DSM 18422 G570DRAFT_scaffold00001.1, whole genome shotgun sequence [1 total record]
GCF_009827535.1_ASM982753v1_genomic.fna	3	0	0	0	0	0	0	0	0	0	0	3	0	0	0	0	0	NZ_WTYN01000010.1 Qipengyuania oceanensis strain MCCC 1A09965 NODE_10_length_4687, whole genome shotgun sequence [14 total records]
GCF_000512205.2_ASM51220v2_genomic.fna	2	0	0	0	0	0	0	0	0	0	0	1	0	0	0	1	0	NZ_CP006644.1 Sphingomonas sanxanigenens DSM 19645 = NX02 chromosome, complete genome [2 total records]
GCF_014334095.1_ASM1433409v1_genomic.fna	3	0	0	0	0	0	0	0	0	0	0	2	0	0	1	0	0	NZ_CP060495.1 Novosphingopyxis iocasae strain PB63 chromosome, complete genome [1 total record]
GCF_002374275.1_ASM237427v1_genomic.fna	2	0	0	0	0	0	0	0	0	0	0	1	0	0	1	0	0	NZ_NWUR01000001.1 Sphingopyxis terrae subsp. ummariensis strain DSM 24316 contig1, whole genome shotgun sequence [22 total records]
GCF_002813245.1_ASM281324v1_genomic.fna	2	0	0	0	0	0	0	0	0	0	0	1	0	0	1	0	0	NZ_PHUF01000002.1 Novosphingobium kunmingense strain CGMCC 1.12274 Ga0171596_101, whole genome shotgun sequence [10 total records]
GCF_003610805.1_ASM361080v1_genomic.fna	3	0	0	0	0	0	0	0	0	0	0	0	1	0	1	1	0	NZ_RAPF01000001.1 Altericroceibacterium spongiae strain HN-Y73 contig1, whole genome shotgun sequence [34 total records]
GCF_007830065.1_ASM783006v1_genomic.fna	3	0	0	0	0	0	0	0	0	0	0	2	0	0	1	0	0	NZ_VLKK01000001.1 Sphingobium wenxiniae strain CGMCC 1.7748 IQ35DRAFT_scaffold00001.1, whole genome shotgun sequence [85 total records]
GCF_019429525.1_ASM1942952v1_genomic.fna	5	0	0	0	0	0	0	0	0	1	1	3	0	0	0	0	0	NZ_JAHXZL010000010.1 Sphingomonas folli strain RHCKR7 NODE_10_length_208970_cov_64.997448, whole genome shotgun sequence [19 total records]
GCF_024349785.1_ASM2434978v1_genomic.fna	4	0	0	0	0	0	0	0	1	0	0	2	0	0	1	0	0	NZ_AP018817.1 Sphingomonas bisphenolicum strain AO1 chromosome 1, complete sequence [6 total records]
GCF_047223455.1_ASM4722345v1_genomic.fna	4	0	0	0	0	0	0	0	0	0	0	3	0	0	1	0	0	NZ_CP178397.1 Sphingomonas carotinifaciens strain ZAFUE012-0842 chromosome, complete genome [4 total records]
GCF_009827545.1_ASM982754v1_genomic.fna	3	0	0	0	0	0	0	0	0	0	0	2	0	0	1	0	0	NZ_WTYS01000001.1 Pontixanthobacter gangjinensis strain JCM 17802 NODE_1_length_2888119, whole genome shotgun sequence [1 total record]
GCF_019711355.1_ASM1971135v1_genomic.fna	4	0	0	0	0	0	0	0	0	0	0	3	0	0	1	0	0	NZ_CP081297.1 Qipengyuania psychrotolerans strain 1XM2-8 chromosome [1 total record]
GCF_030140925.1_ASM3014092v1_genomic.fna	4	0	0	0	0	0	0	0	1	0	0	2	0	0	1	0	0	NZ_JARBWD010000001.1 Parerythrobacter aestuarii strain C18 NODE_1_length_2680612_cov_324.386901, whole genome shotgun sequence [3 total records]
GCF_011761305.1_ASM1176130v1_genomic.fna	2	0	0	0	0	0	0	0	0	0	0	1	1	0	0	0	0	NZ_JAAOZC010000001.1 Sphingomonas vulcanisoli strain CECT 8804 Ga0372438_01, whole genome shotgun sequence [17 total records]
GCF_022568775.1_ASM2256877v1_genomic.fna	1	0	0	0	0	0	0	0	0	0	0	1	0	0	0	0	0	NZ_JAKZHW010000001.1 Sphingomonas telluris strain SM33 1, whole genome shotgun sequence [2 total records]
GCF_040049155.1_ASM4004915v1_genomic.fna	4	0	0	0	0	0	0	1	0	0	0	1	0	0	1	1	0	NZ_JBDZDK010000001.1 Sphingomonas silueang strain VNH70 contig1, whole genome shotgun sequence [85 total records]
GCF_010994245.1_ASM1099424v1_genomic.fna	2	0	0	0	1	0	0	0	0	0	1	0	0	0	0	0	0	NZ_WMHO01000001.1 Sandarakinorhabdus rubra strain MO-4 1, whole genome shotgun sequence [395 total records]
GCF_029167165.1_ASM2916716v1_genomic.fna	4	0	0	0	0	0	0	0	0	0	0	2	0	0	1	1	0	NZ_JARFNJ010000001.1 Sphingomonas pollutisoli strain H39-1-10 spades_K_21_77_1, whole genome shotgun sequence [49 total records]
GCF_900177405.1_IMG-taxon_2708742536_annotated_assembly_genomic.fna	2	0	0	0	0	0	0	0	0	0	0	1	0	0	1	0	0	NZ_LT840185.1 Allosphingosinicella indica strain Dd16 chromosome I [1 total record]
GCF_030717865.1_ASM3071786v1_genomic.fna	1	0	0	0	0	0	0	0	0	0	0	0	0	0	1	0	0	NZ_JAVAIL010000010.1 Qipengyuania benthica strain DY56-A-20 NODE_10_length_7006_cov_208.246067, whole genome shotgun sequence [12 total records]
GCF_001590965.1_ASM159096v1_genomic.fna	4	0	0	0	0	0	0	0	0	0	0	2	1	0	1	0	0	NZ_BCTW01000001.1 Novosphingobium lentum NBRC 107847, whole genome shotgun sequence [49 total records]
GCF_016464365.1_ASM1646436v1_genomic.fna	3	0	0	0	0	0	0	0	0	0	0	2	1	0	0	0	0	NZ_JADCUC010000001.1 Sandaracinobacteroides hominis strain SZY PN-1 SZY_PN-1, whole genome shotgun sequence [19 total records]
GCF_015475875.1_ASM1547587v1_genomic.fna	3	0	0	0	0	0	0	0	0	0	0	2	0	0	1	0	0	NZ_JADKYM010000001.1 Sphingopyxis solisilvae strain R366 NODE_1, whole genome shotgun sequence [49 total records]
GCF_042676985.1_ASM4267698v1_genomic.fna	2	0	0	0	1	0	0	0	0	0	0	0	0	0	1	0	0	NZ_JBHTIK010000001.1 Sphingosinicella xenopeptidilytica strain CCUG 52537 GCM70027544_13, whole genome shotgun sequence [18 total records]
GCF_001010945.1_ASM101094v1_genomic.fna	2	0	0	0	0	0	0	0	0	0	0	1	0	0	1	0	0	NZ_LBHB01000001.1 Aurantiacibacter luteus strain KA37 contig1, whole genome shotgun sequence [9 total records]
GCF_009827495.1_ASM982749v1_genomic.fna	2	0	0	0	0	0	0	0	0	0	0	1	0	0	1	0	0	NZ_WTZA01000001.1 Tsuneonella aeria strain 100921-2 NODE_1_length_2124617, whole genome shotgun sequence [2 total records]
GCF_037154135.1_ASM3715413v1_genomic.fna	3	0	0	0	0	0	0	0	0	0	0	2	0	0	1	0	0	NZ_JBANFL010000001.1 Sphingobium aquiterrae strain DSM 106441 NODE_1_length_476206_cov_151.728175, whole genome shotgun sequence [55 total records]
GCF_033242265.1_ASM3324226v1_genomic.fna	5	0	0	0	0	0	0	0	1	0	0	2	0	0	1	1	0	NZ_BTFW01000001.1 Novosphingobium sp. IK01 sequence1, whole genome shotgun sequence [4 total records]
GCF_039523595.1_ASM3952359v1_genomic.fna	3	0	0	0	0	0	0	0	0	0	0	2	0	0	1	0	0	NZ_BAAAFP010000001.1 Alteraurantiacibacter aestuarii strain JCM 16339 sequence1, whole genome shotgun sequence [3 total records]
GCF_003345355.1_ASM334535v1_genomic.fna	3	0	0	0	0	0	0	0	0	0	0	2	0	0	1	0	0	NZ_QQNB01000010.1 Sphingomonas aracearum strain WZY 27 NODE_10_length_1604_cov_81.369668, whole genome shotgun sequence [12 total records]
GCF_019711535.1_ASM1971153v1_genomic.fna	2	0	0	0	0	0	0	0	0	0	0	2	0	0	0	0	0	NZ_JAIGNP010000001.1 Qipengyuania aestuarii strain GH1 NODE_1_length_1094803_cov_235.856083, whole genome shotgun sequence [4 total records]
GCF_012972675.1_ASM1297267v1_genomic.fna	2	0	0	0	0	0	0	0	0	0	0	1	0	0	1	0	0	NZ_JABCRE010000001.1 Pontixanthobacter rizhaonensis strain RZ02 NODE_1, whole genome shotgun sequence [4 total records]
GCF_001441535.1_ASM144153v1_genomic.fna	4	0	0	0	0	0	0	0	0	0	0	2	1	0	1	0	0	NZ_LMAU01000001.1 Tsuneonella troitsensis strain JCM 17037 JCM17037_1, whole genome shotgun sequence [9 total records]
