GCF_025370095.1_ASM2537009v1_genomic.fna	2	0	0	0	0	0	0	0	0	0	0	1	0	0	1	0	0	NZ_JANQBJ010000001.1 Sphingomonas alpina strain DSM 22537 contig1, whole genome shotgun sequence [17 total records]
GCF_040534015.1_ASM4053401v1_genomic.fna	5	0	0	0	0	0	0	0	0	0	0	3	1	0	1	0	0	NZ_JBEWLY010000001.1 Novosphingobium kalidii strain RD2P27 32, whole genome shotgun sequence [27 total records]
GCF_014205635.1_ASM1420563v1_genomic.fna	4	0	0	0	0	0	0	0	0	0	0	3	0	0	0	1	0	NZ_JACIIV010000001.1 Polymorphobacter multimanifer strain DSM 102189 Ga0373304_01, whole genome shotgun sequence [72 total records]
GCF_003605475.1_ASM360547v1_genomic.fna	3	0	0	0	0	0	0	0	0	0	0	2	0	0	1	0	0	NZ_RAHX01000001.1 Aurantiacibacter aquimixticola strain JSSK-14 scaffold1, whole genome shotgun sequence [2 total records]
GCF_019711615.1_ASM1971161v1_genomic.fna	3	0	0	0	0	0	0	0	0	0	0	2	0	0	1	0	0	NZ_JAIGNS010000001.1 Qipengyuania intermedia strain GH38 NODE_1_length_1256419_cov_224.283396, whole genome shotgun sequence [4 total records]
GCF_000226955.1_ASM22695v2_genomic.fna	2	0	0	0	0	0	0	0	0	0	1	0	0	1	0	0	0	NZ_AGFU01000127.1 Sphingomonas elodea ATCC 31461 contig000127, whole genome shotgun sequence [122 total records]
GCF_023516505.1_ASM2351650v1_genomic.fna	1	0	0	0	0	0	0	0	0	0	0	1	0	0	0	0	0	NZ_JAMGBB010000001.1 Sphingomonas brevis strain RB56-2 1, whole genome shotgun sequence [1 total record]
GCF_019264355.1_ASM1926435v1_genomic.fna	1	0	0	0	0	0	0	0	0	0	0	1	0	0	0	0	0	NZ_JAHVAH010000001.1 Sphingomicrobium clamense strain B8 contig1, whole genome shotgun sequence [1 total record]
GCF_000787715.1_ASM78771v1_genomic.fna	1	0	0	0	0	0	0	0	0	0	0	0	0	0	1	0	0	NZ_BBPI01000121.1 Sphingomonas parapaucimobilis NBRC 15100, whole genome shotgun sequence [117 total records]
GCF_000935025.1_ASM93502v1_genomic.fna	6	0	0	0	0	0	0	0	0	1	0	3	0	0	1	1	0	NZ_CP010836.1 Sphingomonas hengshuiensis strain WHSC-8 isolate soil of Hengshui Lake chromosome, complete genome [2 total records]
GCF_007833215.1_ASM783321v1_genomic.fna	3	0	0	0	0	0	0	0	0	0	0	1	1	0	1	0	0	NZ_CP042239.1 Sphingomonas suaedae strain XS-10 chromosome, complete genome [1 total record]
GCF_042648405.1_ASM4264840v1_genomic.fna	4	0	0	0	1	0	0	0	0	0	0	1	1	0	1	0	0	NZ_JBHRXV010000001.1 Sphingoaurantiacus capsulatus strain KCTC 42644 soapdenovo_K_61_1, whole genome shotgun sequence [20 total records]
GCF_001598455.1_ASM159845v1_genomic.fna	2	0	0	0	0	0	0	0	0	0	0	1	0	0	1	0	0	NZ_BCYZ01000001.1 Sphingomonas pruni NBRC 15498, whole genome shotgun sequence [163 total records]
GCF_013370205.1_ASM1337020v1_genomic.fna	3	0	0	0	0	0	0	0	0	0	1	1	1	0	0	0	0	NZ_JABWGV010000010.1 Actirhodobacter atriluteus strain HHU K3-1 NODE_10_length_17805_cov_248.090035, whole genome shotgun sequence [16 total records]
GCF_019711395.1_ASM1971139v1_genomic.fna	3	0	0	0	0	0	0	0	0	0	0	3	0	0	0	0	0	NZ_JAIGNL010000001.1 Qipengyuania xiapuensis strain 1NDW9 NODE_1_length_1826619_cov_226.369106, whole genome shotgun sequence [2 total records]
GCF_009828065.1_ASM982806v1_genomic.fna	4	0	0	0	0	0	0	0	0	0	0	2	1	0	1	0	0	NZ_WTYK01000010.1 Croceibacterium soli strain MCCC 1K02066 NODE_10_length_79083, whole genome shotgun sequence [15 total records]
GCF_032229225.1_ASM3222922v1_genomic.fna	4	0	0	0	0	0	0	0	0	0	0	3	0	0	1	0	0	NZ_CP135076.1 Stakelama saccharophila strain W311 chromosome [1 total record]
GCF_014652615.1_ASM1465261v1_genomic.fna	1	0	0	0	0	0	0	0	0	0	0	0	0	0	1	0	0	NZ_BMZD01000001.1 Novosphingobium arvoryzae strain KCTC 32422 sequence01, whole genome shotgun sequence [22 total records]
GCF_019711565.1_ASM1971156v1_genomic.fna	5	0	0	0	0	0	0	0	0	1	0	3	0	0	1	0	0	NZ_JAIGNN010000001.1 Qipengyuania proteolytica strain 6B39 NODE_1_length_1826534_cov_227.504389, whole genome shotgun sequence [7 total records]
GCF_019711515.1_ASM1971151v1_genomic.fna	3	0	0	0	0	0	0	0	0	0	0	2	0	0	1	0	0	NZ_JAIGNO010000010.1 Qipengyuania qiaonensis strain 6D47A NODE_10_length_99686_cov_184.015159, whole genome shotgun sequence [33 total records]
GCF_014237875.1_ASM1423787v1_genomic.fna	1	0	0	0	0	0	0	0	0	0	0	0	0	0	1	0	0	NZ_JACJVJ010000001.1 Parasphingopyxis marina strain GrpM-11 GrpM-11_1, whole genome shotgun sequence [5 total records]
GCF_019740335.1_ASM1974033v1_genomic.fna	2	0	0	0	0	0	0	0	0	0	0	1	0	0	1	0	0	NZ_JAHXZS010000010.1 Aquisediminimonas sediminicola strain CH68-4 NODE_10_length_12621_cov_66.597167, whole genome shotgun sequence [13 total records]
GCF_002993885.1_ASM299388v1_genomic.fna	2	0	0	0	0	0	0	0	0	0	0	1	0	0	1	0	0	NZ_CM009578.1 Sphingopyxis lindanitolerans strain WS5A3p chromosome, whole genome shotgun sequence [3 total records]
GCF_025231525.1_ASM2523152v1_genomic.fna	2	0	0	0	0	0	0	0	0	0	0	1	0	0	1	0	0	NZ_CP103057.1 Sphingomonas endolithica strain ZFBP2030 chromosome, complete genome [1 total record]
GCF_000427645.1_ASM42764v1_genomic.fna	2	0	0	0	0	0	0	0	0	0	0	2	0	0	0	0	0	NZ_KE386571.1 Sphingomonas phyllosphaerae FA2 SphspDRAFT_scaffold1.1, whole genome shotgun sequence [2 total records]
GCF_008932225.1_ASM893222v1_genomic.fna	2	0	0	0	0	0	0	0	0	0	0	1	0	0	1	0	0	NZ_CP032228.1 Qipengyuania flava strain 21-3 chromosome, complete genome [1 total record]
GCF_017052455.1_ASM1705245v1_genomic.fna	3	0	0	0	0	0	0	0	0	0	0	2	0	0	1	0	0	NZ_JAFHKU010000086.1 Sphingomonas yabuuchiae strain DSM 14562 k141_103, whole genome shotgun sequence [70 total records]
GCF_019429485.1_ASM1942948v1_genomic.fna	3	0	0	0	0	0	0	0	0	0	1	2	0	0	0	0	0	NZ_JAHXZN010000010.1 Sphingomonas citri strain RRHST34 NODE_10_length_113280_cov_52.082119, whole genome shotgun sequence [27 total records]
GCF_007991615.1_ASM799161v1_genomic.fna	3	0	0	0	0	0	0	0	0	0	0	2	0	0	1	0	0	NZ_BJYR01000001.1 Novosphingobium sediminis strain NBRC 106119 sequence01, whole genome shotgun sequence [59 total records]
GCF_028607105.1_ASM2860710v1_genomic.fna	5	0	0	0	0	0	0	0	1	0	0	2	0	0	1	1	0	NZ_CP117417.1 Novosphingobium humi strain KACC 19094 chromosome, complete genome [4 total records]
GCF_000802225.1_ASM80222v1_genomic.fna	4	0	0	0	0	0	0	0	0	0	0	3	0	0	1	0	0	NZ_JTDI01000001.1 Novosphingobium malaysiense strain MUSC 273 Contig1, whole genome shotgun sequence [20 total records]
GCF_003970925.1_ASM397092v1_genomic.fna	3	0	0	0	0	0	0	0	0	0	0	3	0	0	0	0	0	NZ_RWJF01000001.1 Sphingomonas ginkgonis strain HMF7854 contig00001, whole genome shotgun sequence [2 total records]
GCF_015354055.1_ASM1535405v1_genomic.fna	1	0	0	0	0	0	0	0	0	0	0	1	0	0	0	0	0	NZ_JACHTM010000010.1 Thermaurantiacus tibetensis strain SYSU G02173 NODE_10_length_2372_cov_513.909_ID_966_1, whole genome shotgun sequence [11 total records]
GCF_036687315.1_ASM3668731v1_genomic.fna	4	0	0	0	0	0	0	0	1	0	0	2	0	0	1	0	0	NZ_CP144683.1 Sphingopyxis kveilinensis strain TUF1 chromosome, complete genome [1 total record]
GCF_004564275.1_ASM456427v1_genomic.fna	2	0	0	0	0	0	0	0	0	0	0	1	0	0	1	0	0	NZ_SPDV01000001.1 Sphingomonas parva strain 17J27-24 scf7180000000312, whole genome shotgun sequence [104 total records]
GCF_000379045.1_ASM37904v1_genomic.fna	4	0	0	0	0	0	0	0	0	1	0	2	0	0	1	0	0	NZ_KB900605.1 Sphingomonas melonis DAPP-PG 224 Sphme3DRAFT_scaffold1.1, whole genome shotgun sequence [4 total records]
GCF_032378825.1_ASM3237882v1_genomic.fna	3	0	0	0	0	0	0	0	0	0	0	2	0	0	1	0	0	NZ_JAVUPU010000001.1 Sphingosinicella sp. GR2756 Scaffold1, whole genome shotgun sequence [23 total records]
GCF_001634625.1_ASM163462v1_genomic.fna	3	0	0	0	0	0	0	0	0	0	0	3	0	0	0	0	0	NZ_LRSE01000001.1 Croceicoccus bisphenolivorans strain H4 scaffold1, whole genome shotgun sequence [58 total records]
GCF_001077815.2_ASM107781v2_genomic.fna	4	0	0	0	0	0	0	0	1	0	0	2	0	0	1	0	0	NZ_CP011310.1 Aurantiacibacter atlanticus strain s21-N3 chromosome, complete genome [2 total records]
GCF_019204005.1_ASM1920400v1_genomic.fna	1	0	0	0	0	0	0	0	0	0	0	0	0	0	1	0	0	NZ_JAGSPA010000001.1 Pacificimonas pallii strain WHA3 1, whole genome shotgun sequence [7 total records]
GCF_004792685.1_ASM479268v1_genomic.fna	4	0	0	0	0	0	0	0	0	1	0	2	0	0	1	0	0	NZ_SRXT01000010.1 Sphingomonas gei strain ZFGT-11 NODE_10_length_112909_cov_59.023407, whole genome shotgun sequence [25 total records]
GCF_039537525.1_ASM3953752v1_genomic.fna	1	0	0	0	0	0	0	0	0	0	0	1	0	0	0	0	0	NZ_BAABAR010000001.1 Sphingomonas endophytica strain JCM 17394 sequence01, whole genome shotgun sequence [18 total records]
GCF_007995095.1_ASM799509v1_genomic.fna	2	0	0	0	0	0	0	0	0	0	0	1	0	0	1	0	0	NZ_VOPY01000001.1 Sphingorhabdus soli strain D-2Q-5-6 NODE_1_length_1338471_cov_371.267, whole genome shotgun sequence [4 total records]
GCF_009720245.1_ASM972024v1_genomic.fna	0	0	0	0	0	0	0	0	0	0	0	0	0	0	0	0	0	NZ_WJSQ01000001.1 Sphingomonas segetis strain YJ09 1, whole genome shotgun sequence [297 total records]
GCF_030657335.1_ASM3065733v1_genomic.fna	2	0	0	0	0	0	0	0	0	0	0	1	0	0	1	0	0	NZ_CP131039.1 Croceibacterium aestuarii strain D39 chromosome [1 total record]
GCF_019711375.1_ASM1971137v1_genomic.fna	0	0	0	0	0	0	0	0	0	0	0	0	0	0	0	0	0	NZ_CP081295.1 Qipengyuania aurantiaca strain 1NDH13 chromosome [1 total record]
GCF_900168005.1_IMG-taxon_2706795030_annotated_assembly_genomic.fna	2	0	0	0	0	0	0	0	0	0	0	1	0	0	1	0	0	NZ_FUYP01000117.1 Sphingopyxis flava strain R11H, whole genome shotgun sequence [119 total records]
GCF_042646485.1_ASM4264648v1_genomic.fna	5	0	0	0	0	0	0	1	0	0	0	3	0	0	1	0	0	NZ_JBHRTQ010000001.1 Novosphingobium bradum strain KCTC 42984 platanus_K_21_77_1, whole genome shotgun sequence [16 total records]
GCF_003340475.1_ASM334047v1_genomic.fna	3	0	0	0	0	0	0	0	0	0	0	2	0	0	1	0	0	NZ_QBKA01000001.1 Alteripontixanthobacter maritimus strain HME9302 contig00001, whole genome shotgun sequence [2 total records]
GCF_014230305.1_ASM1423030v1_genomic.fna	1	0	0	0	0	0	0	0	0	0	0	0	0	0	1	0	0	NZ_JACLAU010000100.1 Novosphingobium aerophilum strain 4Y4 NODE_100_length_1488_cov_69.221896, whole genome shotgun sequence [119 total records]
GCF_005434915.1_ASM543491v1_genomic.fna	2	0	0	0	0	0	0	0	0	0	0	1	0	0	1	0	0	NZ_SKCG01000001.1 Aurantiacibacter suaedae strain GH3-15 contig1, whole genome shotgun sequence [8 total records]
GCF_020866845.1_ASM2086684v1_genomic.fna	4	0	0	0	0	0	0	0	0	0	0	3	0	0	1	0	0	NZ_CP086594.1 Sphingomonas radiodurans strain S9-5 chromosome, complete genome [1 total record]
GCF_007995055.1_ASM799505v1_genomic.fna	2	0	0	0	0	0	0	0	0	0	0	1	0	0	1	0	0	NZ_VOQQ01000001.1 Sphingosinicella ginsenosidimutans strain BS-11 0BS11, whole genome shotgun sequence [2 total records]
GCF_013336795.1_ASM1333679v1_genomic.fna	3	0	0	0	0	0	0	0	0	0	0	2	0	0	1	0	0	NZ_JAAFZT010000010.1 Alteripontixanthobacter muriae strain SALINAS58 NODE_10_length_7619_cov_22.846830, whole genome shotgun sequence [37 total records]
GCF_002355275.1_ASM235527v1_genomic.fna	3	0	0	0	0	0	0	0	0	0	0	2	1	0	0	0	0	NZ_CP023449.1 Rhizorhabdus dicambivorans strain Ndbn-20 chromosome, complete genome [5 total records]
GCF_014199325.1_ASM1419932v1_genomic.fna	3	0	0	0	0	0	0	0	0	0	1	2	0	0	0	0	0	NZ_JACIJJ010000001.1 Sphingomonas yantingensis strain DSM 27244 Ga0373344_01, whole genome shotgun sequence [11 total records]
GCF_014200045.1_ASM1420004v1_genomic.fna	4	0	0	0	0	0	0	0	0	0	1	1	1	0	1	0	0	NZ_JACHOV010000001.1 Rhizorhapis suberifaciens strain DSM 7465 Ga0373210_01, whole genome shotgun sequence [34 total records]
GCF_003391115.1_ASM339111v1_genomic.fna	3	0	0	0	0	0	0	0	0	0	0	3	0	0	0	0	0	NZ_QTJP01000001.1 Sphingomonas crusticola strain MIMD3 contig1, whole genome shotgun sequence [2 total records]
GCF_003605755.1_ASM360575v1_genomic.fna	2	0	0	0	0	0	0	0	0	0	0	1	0	0	1	0	0	NZ_RAHJ01000003.1 Tsuneonella suprasediminis strain Ery12 298, whole genome shotgun sequence [21 total records]
GCF_900115585.1_IMG-taxon_2619618819_annotated_assembly_genomic.fna	1	0	0	0	0	0	0	0	0	0	0	0	0	0	1	0	0	NZ_FOWZ01000011.1 Qipengyuania nanhaisediminis strain CGMCC 1.7715, whole genome shotgun sequence [12 total records]
GCF_014196055.1_ASM1419605v1_genomic.fna	4	0	0	0	0	0	0	0	0	0	1	1	0	0	1	1	0	NZ_JACICY010000001.1 Novosphingobium hassiacum strain DSM 14552 Ga0373213_01, whole genome shotgun sequence [56 total records]
GCF_003958635.1_ASM395863v1_genomic.fna	4	0	0	0	0	0	1	0	0	0	0	2	1	0	0	0	0	NZ_RSEK01000010.1 Altericroceibacterium xinjiangense strain CCTCC AB 207166 NODE_10_length_89715_cov_932.012182, whole genome shotgun sequence [59 total records]
GCF_019711635.1_ASM1971163v1_genomic.fna	1	0	0	0	0	0	0	0	0	0	0	1	0	0	0	0	0	NZ_JAIGNT010000010.1 Qipengyuania huizhouensis strain YG19 NODE_10_length_96399_cov_277.580320, whole genome shotgun sequence [27 total records]
GCF_014641735.1_ASM1464173v1_genomic.fna	1	0	0	0	0	0	0	0	0	0	0	1	0	0	0	0	0	NZ_BMIH01000001.1 Sphingomonas metalli strain CGMCC 1.15330 sequence01, whole genome shotgun sequence [16 total records]
GCF_020687785.1_ASM2068778v1_genomic.fna	0	0	0	0	0	0	0	0	0	0	0	0	0	0	0	0	0	NZ_JAJEWI010000005.1 Sphingopyxis yananensis strain FBM22 MFBS23_ctg0001, whole genome shotgun sequence [12 total records]
GCF_009827995.1_ASM982799v1_genomic.fna	5	0	0	0	0	0	0	0	0	0	0	4	0	0	1	0	0	NZ_WTYE01000001.1 Parerythrobacter jejuensis strain JCM 16677 JCM16677_1, whole genome shotgun sequence [1 total record]
GCF_026420865.1_ASM2642086v1_genomic.fna	4	0	0	0	0	0	0	0	0	0	0	2	0	0	1	1	0	NZ_JAPCWC010000001.1 Novosphingobium clariflavum strain 164 1, whole genome shotgun sequence [94 total records]
GCF_019711415.1_ASM1971141v1_genomic.fna	3	0	0	0	0	0	0	0	0	0	0	2	1	0	0	0	0	NZ_JAIGNJ010000001.1 Qipengyuania vesicularis strain 1NDH10 NODE_1_length_1113808_cov_214.728530, whole genome shotgun sequence [4 total records]
GCF_900113315.1_IMG-taxon_2654588199_annotated_assembly_genomic.fna	4	0	0	0	0	0	0	0	0	0	0	3	0	0	1	0	0	NZ_FOZG01000006.1 Sphingomonas jatrophae strain S5-249, whole genome shotgun sequence [6 total records]
GCF_014117445.1_ASM1411744v1_genomic.fna	2	0	0	0	1	0	0	0	0	0	0	1	0	0	0	0	0	NZ_CP059851.1 Sandaracinobacteroides saxicola strain M6 chromosome, complete genome [1 total record]
GCF_034374265.1_ASM3437426v1_genomic.fna	2	0	0	0	0	0	0	0	0	0	0	1	0	0	1	0	0	NZ_CP139718.1 Blastomonas marina strain OXR-134 chromosome, complete genome [1 total record]
GCF_015694345.1_ASM1569434v1_genomic.fna	3	0	0	0	0	0	0	0	0	0	0	2	0	0	1	0	0	NZ_JADQDC010000010.1 Novosphingobium jiangmenense strain 1Y9A NODE_10_length_162837_cov_51.634110, whole genome shotgun sequence [31 total records]
GCF_039710615.1_ASM3971061v1_genomic.fna	3	0	0	0	0	0	0	0	0	0	0	2	0	0	1	0	0	NZ_JBDLBR010000001.1 Aurantiacibacter flavus strain DGU5 contig1, whole genome shotgun sequence [22 total records]
GCF_000445125.1_ASM44512v1_genomic.fna	7	0	0	0	0	0	0	0	1	1	0	2	1	0	1	1	0	NZ_ATHL01000001.1 Novosphingobium lindaniclasticum LE124 contig001, whole genome shotgun sequence [140 total records]
GCF_005884405.1_ASM588440v1_genomic.fna	3	0	0	0	0	0	0	0	0	0	0	2	0	0	1	0	0	NZ_VCAO01000001.1 Qipengyuania marisflavi strain KEM-5 contig1, whole genome shotgun sequence [17 total records]
GCF_000974765.1_ASM97476v1_genomic.fna	2	0	0	0	0	0	0	0	1	0	0	1	0	0	0	0	0	NZ_BBWU01000053.1 Sphingomonas changbaiensis NBRC 104936, whole genome shotgun sequence [53 total records]
GCF_034375205.1_ASM3437520v1_genomic.fna	2	0	0	0	0	0	0	0	0	0	0	1	0	0	1	0	0	NZ_CP139719.1 Pelagerythrobacter marinus strain OXR-96 chromosome, complete genome [1 total record]
GCF_026013565.1_ASM2601356v1_genomic.fna	3	0	0	0	0	0	0	0	0	0	0	3	0	0	0	0	0	NZ_JAPDOB010000001.1 Sphingomonas arvum strain BN140010 contig1, whole genome shotgun sequence [4 total records]
GCF_014645195.1_ASM1464519v1_genomic.fna	3	0	0	0	0	0	0	0	0	0	0	2	0	0	1	0	0	NZ_BMLK01000001.1 Novosphingobium indicum strain CGMCC 1.6784 sequence001, whole genome shotgun sequence [93 total records]
GCF_009828105.1_ASM982810v1_genomic.fna	3	0	0	0	0	0	0	0	0	0	0	1	1	0	1	0	0	NZ_WTYQ01000010.1 Altericroceibacterium indicum strain DSM 18604 NODE_10_length_5800, whole genome shotgun sequence [20 total records]
GCF_023516575.1_ASM2351657v1_genomic.fna	1	0	0	0	0	0	0	0	0	0	0	1	0	0	0	0	0	NZ_JAMGBE010000001.1 Sphingomonas hankyongi strain SE220 1, whole genome shotgun sequence [4 total records]
GCF_023516555.1_ASM2351655v1_genomic.fna	1	0	0	0	0	0	0	0	0	0	0	1	0	0	0	0	0	NZ_JAMGBD010000001.1 Sphingomonas alba strain SE158 1, whole genome shotgun sequence [2 total records]
GCF_003050705.1_ASM305070v1_genomic.fna	4	0	0	0	0	0	0	0	0	0	0	3	0	0	1	0	0	NZ_QAOG01000001.1 Sphingomonas aurantiaca strain MA101b Ga0191660_101, whole genome shotgun sequence [13 total records]
GCF_003171715.1_ASM317171v1_genomic.fna	2	0	0	0	0	0	0	0	0	0	0	1	0	0	1	0	0	NZ_QGHL01000007.1 Novosphingobium meiothermophilum strain SYSU G00007 SYSU_G00007_Contig1, whole genome shotgun sequence [19 total records]
GCF_037996805.1_ASM3799680v1_genomic.fna	3	0	0	0	0	0	0	0	0	0	0	2	0	0	1	0	0	NZ_JBBNAX010000001.1 Erythrobacter alti strain NBRC 111903 contig_01, whole genome shotgun sequence [10 total records]
GCF_021227995.1_ASM2122799v1_genomic.fna	6	0	0	0	0	0	0	0	0	0	0	4	0	0	1	1	0	NZ_CP089301.1 Novosphingobium kaempferiae strain Sx8-5 chromosome, complete genome [1 total record]
GCF_021502585.1_ASM2150258v1_genomic.fna	1	0	0	0	0	0	0	0	0	0	0	1	0	0	0	0	0	NZ_JAKFGM010000001.1 Sphingomonas cremea strain G124 1, whole genome shotgun sequence [8 total records]
GCF_011927725.1_ASM1192772v1_genomic.fna	2	0	0	0	0	0	0	0	0	0	0	2	0	0	0	0	0	NZ_JAATJC010000001.1 Sphingomonas kaistensis strain DSM 16846 Ga0373220_01, whole genome shotgun sequence [1 total record]
GCF_001046635.1_N.barLL02_genomic.fna	6	0	0	0	0	0	0	0	0	0	0	4	0	0	1	1	0	NZ_KQ130452.1 Novosphingobium barchaimii LL02 25411_scaffold_01, whole genome shotgun sequence [19 total records]
GCF_014199635.1_ASM1419963v1_genomic.fna	1	0	0	0	0	0	0	0	0	0	0	0	0	0	1	0	0	NZ_JACHOA010000001.1 Novosphingobium taihuense strain DSM 17507 Ga0373318_01, whole genome shotgun sequence [19 total records]
GCF_025154015.1_ASM2515401v1_genomic.fna	2	0	0	0	0	0	0	0	0	0	0	1	0	0	1	0	0	NZ_JAOAMV010000010.1 Tsuneonella litorea strain YG55 NODE_10_length_22799_cov_284.553516, whole genome shotgun sequence [26 total records]
GCF_002355855.1_ASM235585v1_genomic.fna	4	0	0	0	0	0	0	0	0	0	0	3	0	0	1	0	0	NZ_AP017655.1 Sphingobium cloacae strain JCM 10874 chromosome SCLO_1, complete sequence [7 total records]
GCF_026013525.1_ASM2601352v1_genomic.fna	4	0	0	0	0	0	0	0	0	0	0	2	1	0	1	0	0	NZ_JAPDRA010000001.1 Sphingomonas canadensis strain FWC47 FWC47_scaffold1, whole genome shotgun sequence [27 total records]
GCF_016743815.1_ASM1674381v1_genomic.fna	3	0	0	0	0	0	0	0	0	0	0	2	0	0	1	0	0	NZ_CP061035.1 Sphingomonas aliaeris strain DH-S5 chromosome, complete genome [3 total records]
GCF_001661915.1_ASM166191v1_genomic.fna	2	0	0	0	0	0	0	0	0	0	1	1	0	0	0	0	0	NZ_LYWY01000010.1 Croceicoccus pelagius strain Ery9 Ery9_C10_4733, whole genome shotgun sequence [40 total records]
GCF_023051225.1_ASM2305122v1_genomic.fna	4	0	0	0	0	0	0	0	0	0	0	3	0	0	1	0	0	NZ_JALKHS010000001.1 Sphingobium agri strain MAH-33 platanus_K_25_97_1, whole genome shotgun sequence [27 total records]
GCF_026157155.1_ASM2615715v1_genomic.fna	2	0	0	0	0	0	0	0	0	0	0	2	0	0	0	0	0	NZ_JANPVO010000001.1 Sphingomicrobium astaxanthinifaciens strain JCM 18551 NODE_1_length_1125872_cov_336.249378, whole genome shotgun sequence [3 total records]
GCF_042680825.1_ASM4268082v1_genomic.fna	2	0	0	0	0	0	0	0	0	0	1	0	1	0	0	0	0	NZ_JBHUEL010000001.1 Sphingorhabdus buctiana strain CGMCC 1.12929 platanus_K_25_97_1, whole genome shotgun sequence [17 total records]
GCF_018398395.1_ASM1839839v1_genomic.fna	3	0	0	0	0	0	0	0	0	0	0	3	0	0	0	0	0	NZ_JAHCBF010000010.1 Croceicoccus gelatinilyticus strain 1NDH52 NODE_10_length_68790_cov_169.980033, whole genome shotgun sequence [43 total records]
GCF_037154015.1_ASM3715401v1_genomic.fna	2	0	0	0	0	0	0	0	0	0	0	1	0	0	1	0	0	NZ_JBANRL010000001.1 Altererythrobacter aquiaggeris strain KCTC 52471 NODE_1_length_2626838_cov_283.942834, whole genome shotgun sequence [2 total records]
GCF_003583725.1_ASM358372v1_genomic.fna	1	0	0	0	0	0	0	0	0	0	0	1	0	0	0	0	0	NZ_QXTF01000001.1 Sphingomonas edaphi strain DAC4 contig1, whole genome shotgun sequence [5 total records]
GCF_011761945.1_ASM1176194v1_genomic.fna	3	0	0	0	0	0	0	0	0	1	0	1	0	0	1	0	0	NZ_JAASQV010000001.1 Sphingomonas leidyi strain DSM 4733 Ga0373306_01, whole genome shotgun sequence [10 total records]
GCF_009828115.1_ASM982811v1_genomic.fna	4	0	0	0	0	0	0	0	0	0	0	3	0	0	1	0	0	NZ_WTYL01000001.1 Allopontixanthobacter sediminis strain KCTC 42453 NODE_1_length_1194408, whole genome shotgun sequence [6 total records]
GCF_001281485.1_ASM128148v1_genomic.fna	3	0	0	0	0	0	0	0	0	0	0	2	0	0	1	0	0	NZ_CP012669.1 Altererythrobacter epoxidivorans strain CGMCC 1.7731 chromosome, complete genome [1 total record]
GCF_009827655.1_ASM982765v1_genomic.fna	2	0	0	0	0	0	0	0	0	0	0	1	0	0	1	0	0	NZ_WTYV01000010.1 Alteraurantiacibacter buctensis strain M0322 NODE_10_length_59022, whole genome shotgun sequence [22 total records]
GCF_003050615.1_ASM305061v1_genomic.fna	6	0	0	0	0	2	0	0	0	0	0	3	0	0	0	1	0	NZ_NWBU01000013.1 Sphingomonas oleivorans strain FW-11 C101, whole genome shotgun sequence [19 total records]
GCF_022014495.1_ASM2201449v1_genomic.fna	2	0	0	0	0	0	0	0	0	0	0	2	0	0	0	0	0	NZ_JAKLSQ010000001.1 Sandaracinobacteroides sayramensis strain RS1-74 soapdenovo_K_61_1, whole genome shotgun sequence [39 total records]
GCF_001625325.1_ASM162532v1_genomic.fna	2	0	0	0	0	0	0	0	0	0	0	1	0	0	1	0	0	NZ_JRQQ01000001.1 Croceicoccus estronivorus strain MH-B5 contig1, whole genome shotgun sequence [22 total records]
GCF_016025255.1_ASM1602525v1_genomic.fna	1	0	0	0	0	0	0	0	0	0	0	1	0	0	0	0	0	NZ_CP065592.1 Sphingosinicella flava strain UDD2 chromosome [1 total record]
GCF_011320115.1_ASM1132011v1_genomic.fna	3	0	0	0	0	0	0	0	0	0	0	1	1	0	1	0	0	NZ_JAANOZ010000001.1 Altererythrobacter segetis strain YJ20 1, whole genome shotgun sequence [34 total records]
GCF_018491765.1_ASM1849176v1_genomic.fna	5	0	0	0	0	0	0	0	1	0	0	3	0	0	1	0	0	NZ_JABWCU010000001.1 Novosphingobium profundi strain F72 NODE_1, whole genome shotgun sequence [70 total records]
GCF_043589935.1_ASM4358993v1_genomic.fna	2	0	0	0	0	0	0	0	0	1	0	0	0	0	1	0	0	NZ_CP171454.1 Sphingobium naphthae strain RL-ZY01 chromosome, complete genome [7 total records]
GCF_001591025.1_ASM159102v1_genomic.fna	3	0	0	0	0	0	0	0	0	1	0	1	0	0	1	0	0	NZ_BCTZ01000001.1 Sphingomonas soli NBRC 100801, whole genome shotgun sequence [34 total records]
GCF_014204535.1_ASM1420453v1_genomic.fna	4	0	0	0	0	0	0	0	0	0	0	2	0	0	1	1	0	NZ_JACHLR010000001.1 Novosphingobium chloroacetimidivorans strain S00245 Ga0436340_01, whole genome shotgun sequence [88 total records]
GCF_037154085.1_ASM3715408v1_genomic.fna	2	0	0	0	0	0	0	0	0	0	0	1	0	0	1	0	0	NZ_JBANRM010000001.1 Altererythrobacter fulvus strain KACC 19119 NODE_1_length_1200119_cov_259.731839, whole genome shotgun sequence [11 total records]
GCF_037154195.1_ASM3715419v1_genomic.fna	5	0	0	0	0	0	0	0	1	0	0	2	1	0	1	0	0	NZ_JBANFM010000001.1 Sphingobium aromaticivastans strain DSM 105181 NODE_1_length_376662_cov_127.836133, whole genome shotgun sequence [90 total records]
GCF_019711315.1_ASM1971131v1_genomic.fna	3	0	0	0	0	0	0	0	0	0	0	2	1	0	0	0	0	NZ_CP081294.1 Qipengyuania gelatinilytica strain 1NDH1 chromosome [1 total record]
GCF_008274695.1_ASM827469v1_genomic.fna	3	0	0	0	0	0	0	0	0	0	1	1	1	0	0	0	0	NZ_VTOU01000001.1 Sphingomonas montanisoli strain ZX XEX_1, whole genome shotgun sequence [15 total records]
GCF_001663175.1_ASM166317v1_genomic.fna	3	0	0	0	0	0	0	0	0	0	0	2	0	0	1	0	0	NZ_CP016033.1 Erythrobacter neustonensis strain DSM 9434 chromosome, complete genome [1 total record]
GCF_001598575.1_ASM159857v1_genomic.fna	1	0	0	0	0	0	0	0	0	0	0	0	0	0	1	0	0	NZ_BCZF01000001.1 Novosphingobium subterraneum NBRC 16086, whole genome shotgun sequence [107 total records]
GCF_013778325.1_ASM1377832v1_genomic.fna	1	0	0	0	0	0	0	0	0	0	0	0	0	0	1	0	0	NZ_JACEIB010000001.1 Sphingomonas chungangi strain CGMCC 1.13654 soapdenovo_K_83_1, whole genome shotgun sequence [22 total records]
GCF_037572715.1_ASM3757271v1_genomic.fna	3	0	0	0	0	0	0	0	0	0	0	2	0	0	1	0	0	NZ_JBBHJY010000001.1 Novosphingobium aquae strain AS3R-12 1, whole genome shotgun sequence [29 total records]
GCF_018122655.1_ASM1812265v1_genomic.fna	3	0	0	0	0	0	0	0	0	1	0	1	0	0	1	0	0	NZ_JAGRQC010000001.1 Stakelama marina strain LXI357 1, whole genome shotgun sequence [12 total records]
GCF_035930445.1_ASM3593044v1_genomic.fna	3	0	0	0	0	0	0	0	0	0	0	2	0	0	1	0	0	NZ_CP142394.1 Sphingopyxis chilensis strain S37 chromosome, complete genome [1 total record]
GCF_003129465.1_ASM312946v1_genomic.fna	3	0	0	0	0	0	0	0	0	0	0	2	0	0	1	0	0	NZ_QFFF01000001.1 Sphingosinicella humi strain QZX222 contig1, whole genome shotgun sequence [3 total records]
GCF_001028705.1_ASM102870v1_genomic.fna	1	0	0	0	0	0	0	0	0	0	0	1	0	0	0	0	0	NZ_CP011770.1 Croceicoccus naphthovorans strain PQ-2 chromosome, complete genome [3 total records]
GCF_046000505.1_ASM4600050v1_genomic.fna	3	0	0	0	0	0	0	0	1	0	0	1	0	0	1	0	0	NZ_JBELQC010000001.1 Sphingomonas sp. ST-64 NODE_1_length_2571106_cov_301.415687, whole genome shotgun sequence [4 total records]
GCF_020179425.1_ASM2017942v1_genomic.fna	4	0	0	0	0	0	0	0	0	0	0	3	0	0	1	0	0	NZ_JAILYM010000010.1 Novosphingobium percolationis strain c1 NODE_10_length_97344_cov_67.932306_10, whole genome shotgun sequence [25 total records]
GCF_000764535.1_ASM76453v1_genomic.fna	2	0	0	0	0	0	0	0	0	0	0	1	0	0	1	0	0	NZ_CP009571.1 Sphingomonas taxi strain ATCC 55669 chromosome, complete genome [3 total records]
GCF_018286635.1_ASM1828663v1_genomic.fna	3	0	0	0	0	0	0	0	0	0	0	1	1	0	1	0	0	NZ_CP073910.1 Sphingobium phenoxybenzoativorans strain Tas13 chromosome, complete genome [1 total record]
GCF_000447205.1_ABySS_v1.3.3_genomic.fna	2	0	0	0	0	0	0	0	0	0	0	1	0	0	1	0	0	NZ_AUWY01000001.1 Sphingobium ummariense RL-3 contig001, whole genome shotgun sequence [130 total records]
GCF_039522915.1_ASM3952291v1_genomic.fna	2	0	0	0	0	0	0	0	0	0	0	1	0	0	1	0	0	NZ_BAAAEH010000001.1 Sphingomonas oligophenolica strain JCM 12082 sequence01, whole genome shotgun sequence [70 total records]
GCF_947494915.1_3-2146-J.fasta_genomic.fna	3	0	0	0	0	0	0	0	0	0	0	2	0	0	1	0	0	NZ_CANLWR010000001.1 Pontixanthobacter luteolus isolate 3-2146-J.fasta NODE_1, whole genome shotgun sequence [4 total records]
