genome_id	record_id	region	start	end	contig_edge	product	KCB_hit	KCB_acc	KCB_sim	record_desc	Category	n_Category	Domain	Phylum	Class	Order	Family	Genus	Species	shared_name	product_1
GCF_011761305.1_genomic	NZ_JAAOZC010000003.1	2	292061	347167	FALSE	putative_wzy_dependent				NZ_JAAOZC010000003.1 Sphingomonas vulcanisoli strain CECT 8804 Ga0372438_03, whole genome shotgun sequence	Uncharacterised	1								NZ_JAAOZC010000003.1.region002.gbk_region_1	Uncharacterised
GCF_014199685.1_genomic	NZ_JACHNZ010000001.1	1	259854	283346	TRUE	sphingomonadales_eps				NZ_JACHNZ010000001.1 Sphingosinicella soli strain DSM 17328 Ga0373316_01, whole genome shotgun sequence	NA									NZ_JACHNZ010000001.1.region001.gbk_region_1	sphingomonadales_eps
GCF_014199685.1_genomic	NZ_JACHNZ010000029.1	1	42858	51543	TRUE	curdlan-like				NZ_JACHNZ010000029.1 Sphingosinicella soli strain DSM 17328 Ga0373316_29, whole genome shotgun sequence	Synthase	2								NZ_JACHNZ010000029.1.region001.gbk_region_1	curdlan-like
GCF_029688625.1_genomic	NZ_JARULC010000001.1	1	415761	461659	FALSE	putative_wzy_dependent				NZ_JARULC010000001.1 Qipengyuania sp. XHP0207 NODE_1_length_1040360_cov_213.296958, whole genome shotgun sequence	Uncharacterised	1								NZ_JARULC010000001.1.region001.gbk_region_1	Uncharacterised
GCF_029688625.1_genomic	NZ_JARULC010000001.1	2	707874	765777	FALSE	putative_wzy_dependent				NZ_JARULC010000001.1 Qipengyuania sp. XHP0207 NODE_1_length_1040360_cov_213.296958, whole genome shotgun sequence	Uncharacterised	1								NZ_JARULC010000001.1.region002.gbk_region_1	Uncharacterised
GCF_029688625.1_genomic	NZ_JARULC010000001.1	3	912833	938994	FALSE	sphingomonadales_eps				NZ_JARULC010000001.1 Qipengyuania sp. XHP0207 NODE_1_length_1040360_cov_213.296958, whole genome shotgun sequence	NA									NZ_JARULC010000001.1.region003.gbk_region_1	sphingomonadales_eps
GCF_029688625.1_genomic	NZ_JARULC010000002.1	1	149415	207434	FALSE	putative_wzy_dependent				NZ_JARULC010000002.1 Qipengyuania sp. XHP0207 NODE_2_length_911013_cov_219.735822, whole genome shotgun sequence	Uncharacterised	1								NZ_JARULC010000002.1.region001.gbk_region_1	Uncharacterised
GCF_000802385.1_genomic	NZ_JTDN01000001.1	1	331820	350607	FALSE	cellulose-generic				NZ_JTDN01000001.1 Croceibacterium mercuriale strain Coronado scaffold_0, whole genome shotgun sequence	Synthase	2								NZ_JTDN01000001.1.region001.gbk_region_1	cellulose-generic
GCF_000802385.1_genomic	NZ_JTDN01000002.1	1	755555	808676	FALSE	putative_wzy_dependent				NZ_JTDN01000002.1 Croceibacterium mercuriale strain Coronado scaffold_1, whole genome shotgun sequence	Uncharacterised	1								NZ_JTDN01000002.1.region001.gbk_region_1	Uncharacterised
GCF_000802385.1_genomic	NZ_JTDN01000002.1	2	905255	922486	FALSE	putative_wzy_dependent				NZ_JTDN01000002.1 Croceibacterium mercuriale strain Coronado scaffold_1, whole genome shotgun sequence	Uncharacterised	1								NZ_JTDN01000002.1.region002.gbk_region_1	Uncharacterised
GCA_947501885.1_genomic	CANMXN010000001.1	1	1619543	1644083	FALSE	putative_wzy_dependent				CANMXN010000001.1 uncultured Sphingorhabdus sp. isolate 2-338.fasta genome assembly, contig: NODE_1, whole genome shotgun sequence	Uncharacterised	1								CANMXN010000001.1.region001.gbk_region_1	Uncharacterised
GCA_947501885.1_genomic	CANMXN010000003.1	1	22535	49609	FALSE	sphingomonadales_eps				CANMXN010000003.1 uncultured Sphingorhabdus sp. isolate 2-338.fasta genome assembly, contig: NODE_3, whole genome shotgun sequence	NA									CANMXN010000003.1.region001.gbk_region_1	sphingomonadales_eps
GCF_003050615.1_genomic	NZ_NWBU01000006.1	1	0	27102	TRUE	putative_wzy_dependent				NZ_NWBU01000006.1 Sphingomonas oleivorans strain FW-11 C153, whole genome shotgun sequence	Uncharacterised	1								NZ_NWBU01000006.1.region001.gbk_region_1	Uncharacterised
GCF_003050615.1_genomic	NZ_NWBU01000010.1	1	88974	100132	FALSE	fructansucrase				NZ_NWBU01000010.1 Sphingomonas oleivorans strain FW-11 scaffold4, whole genome shotgun sequence	Sucrase	4								NZ_NWBU01000010.1.region001.gbk_region_1	fructansucrase
GCF_003050615.1_genomic	NZ_NWBU01000005.1	1	206745	217903	FALSE	fructansucrase				NZ_NWBU01000005.1 Sphingomonas oleivorans strain FW-11 scaffold5, whole genome shotgun sequence	Sucrase	4								NZ_NWBU01000005.1.region001.gbk_region_1	fructansucrase
GCF_003050615.1_genomic	NZ_NWBU01000005.1	2	404084	435952	FALSE	putative_wzy_dependent				NZ_NWBU01000005.1 Sphingomonas oleivorans strain FW-11 scaffold5, whole genome shotgun sequence	Uncharacterised	1								NZ_NWBU01000005.1.region002.gbk_region_1	Uncharacterised
GCF_003050615.1_genomic	NZ_NWBU01000004.1	1	601940	632497	FALSE	putative_wzy_dependent				NZ_NWBU01000004.1 Sphingomonas oleivorans strain FW-11 scaffold6, whole genome shotgun sequence	Uncharacterised	1								NZ_NWBU01000004.1.region001.gbk_region_1	Uncharacterised
GCF_003050615.1_genomic	NZ_NWBU01000004.1	2	1026032	1045113	FALSE	cellulose-type-1				NZ_NWBU01000004.1 Sphingomonas oleivorans strain FW-11 scaffold6, whole genome shotgun sequence	Synthase	2								NZ_NWBU01000004.1.region002.gbk_region_1	cellulose-type-1
GCF_000632225.1_genomic	NZ_JFYV01000010.1	1	0	27980	TRUE	putative_wzy_dependent				NZ_JFYV01000010.1 Sphingomonas sp. RIT328 contigs18, whole genome shotgun sequence	Uncharacterised	1								NZ_JFYV01000010.1.region001.gbk_region_1	Uncharacterised
GCF_000632225.1_genomic	NZ_JFYV01000010.1	2	47807	97927	TRUE	putative_wzy_dependent				NZ_JFYV01000010.1 Sphingomonas sp. RIT328 contigs18, whole genome shotgun sequence	Uncharacterised	1								NZ_JFYV01000010.1.region002.gbk_region_1	Uncharacterised
GCF_000632225.1_genomic	NZ_JFYV01000054.1	1	88726	114475	FALSE	sphingomonadales_eps				NZ_JFYV01000054.1 Sphingomonas sp. RIT328 contigs7, whole genome shotgun sequence	NA									NZ_JFYV01000054.1.region001.gbk_region_1	sphingomonadales_eps
GCF_001476905.1_genomic	NZ_LDTE01000086.1	1	30354	76966	TRUE	putative_wzy_dependent				NZ_LDTE01000086.1 Sphingomonas sanguinis strain SB4 contig_86, whole genome shotgun sequence	Uncharacterised	1								NZ_LDTE01000086.1.region001.gbk_region_1	Uncharacterised
GCF_011320075.1_genomic	NZ_JAANPA010000014.1	1	18012	44641	FALSE	sphingomonadales_eps				NZ_JAANPA010000014.1 Sphingosinicella sp. YJ22 14, whole genome shotgun sequence	NA									NZ_JAANPA010000014.1.region001.gbk_region_1	sphingomonadales_eps
GCF_011320075.1_genomic	NZ_JAANPA010000002.1	1	151574	176764	TRUE	putative_wzy_dependent				NZ_JAANPA010000002.1 Sphingosinicella sp. YJ22 2, whole genome shotgun sequence	Uncharacterised	1								NZ_JAANPA010000002.1.region001.gbk_region_1	Uncharacterised
GCF_011320075.1_genomic	NZ_JAANPA010000007.1	1	50439	85290	TRUE	putative_ABC_dependent_NO_OPX				NZ_JAANPA010000007.1 Sphingosinicella sp. YJ22 7, whole genome shotgun sequence	Uncharacterised	1								NZ_JAANPA010000007.1.region001.gbk_region_1	Uncharacterised
GCF_004208535.1_genomic	NZ_SGIS01000001.1	1	253116	278932	TRUE	sphingomonadales_eps				NZ_SGIS01000001.1 Sphingomonas populi strain 3-7 Scaffold1, whole genome shotgun sequence	NA									NZ_SGIS01000001.1.region001.gbk_region_1	sphingomonadales_eps
GCF_004208535.1_genomic	NZ_SGIS01000002.1	1	246270	264376	TRUE	cellulose-type-1				NZ_SGIS01000002.1 Sphingomonas populi strain 3-7 Scaffold2, whole genome shotgun sequence	Synthase	2								NZ_SGIS01000002.1.region001.gbk_region_1	cellulose-type-1
GCF_004208535.1_genomic	NZ_SGIS01000033.1	1	0	35939	TRUE	putative_wzy_dependent				NZ_SGIS01000033.1 Sphingomonas populi strain 3-7 Scaffold33, whole genome shotgun sequence	Uncharacterised	1								NZ_SGIS01000033.1.region001.gbk_region_1	Uncharacterised
GCF_004208535.1_genomic	NZ_SGIS01000036.1	1	16605	50644	TRUE	putative_wzy_dependent				NZ_SGIS01000036.1 Sphingomonas populi strain 3-7 Scaffold36, whole genome shotgun sequence	Uncharacterised	1								NZ_SGIS01000036.1.region001.gbk_region_1	Uncharacterised
GCF_004208535.1_genomic	NZ_SGIS01000045.1	1	0	26724	TRUE	putative_wzy_dependent				NZ_SGIS01000045.1 Sphingomonas populi strain 3-7 Scaffold45, whole genome shotgun sequence	Uncharacterised	1								NZ_SGIS01000045.1.region001.gbk_region_1	Uncharacterised
GCF_000756375.1_genomic	NZ_JNFD01000021.1	1	214674	281621	FALSE	putative_wzy_dependent				NZ_JNFD01000021.1 Sphingopyxis sp. LC81 contig28, whole genome shotgun sequence	Uncharacterised	1								NZ_JNFD01000021.1.region001.gbk_region_1	Uncharacterised
GCF_000756375.1_genomic	NZ_JNFD01000030.1	1	100318	134223	FALSE	putative_wzy_dependent				NZ_JNFD01000030.1 Sphingopyxis sp. LC81 contig36, whole genome shotgun sequence	Uncharacterised	1								NZ_JNFD01000030.1.region001.gbk_region_1	Uncharacterised
GCF_000756375.1_genomic	NZ_JNFD01000036.1	1	48138	74956	FALSE	sphingomonadales_eps				NZ_JNFD01000036.1 Sphingopyxis sp. LC81 contig41, whole genome shotgun sequence	NA									NZ_JNFD01000036.1.region001.gbk_region_1	sphingomonadales_eps
GCF_900167915.1_genomic	NZ_FUYM01000004.1	1	98074	135939	FALSE	putative_wzy_dependent				NZ_FUYM01000004.1 Rhizorhabdus histidinilytica strain UM2, whole genome shotgun sequence	Uncharacterised	1								NZ_FUYM01000004.1.region001.gbk_region_1	Uncharacterised
GCF_900167915.1_genomic	NZ_FUYM01000001.1	1	235404	257504	FALSE	putative_wzy_dependent				NZ_FUYM01000001.1 Rhizorhabdus histidinilytica strain UM2, whole genome shotgun sequence	Uncharacterised	1								NZ_FUYM01000001.1.region001.gbk_region_1	Uncharacterised
GCF_900167915.1_genomic	NZ_FUYM01000002.1	1	492639	556411	FALSE	putative_wzy_dependent				NZ_FUYM01000002.1 Rhizorhabdus histidinilytica strain UM2, whole genome shotgun sequence	Uncharacterised	1								NZ_FUYM01000002.1.region001.gbk_region_1	Uncharacterised
GCF_015865035.1_genomic	NZ_JADZGI010000001.1	1	0	34201	TRUE	putative_wzy_dependent_NO_OPX				NZ_JADZGI010000001.1 Novosphingobium aureum strain YJ-S2-02 NODE_1_length_2857627_cov_53.530272, whole genome shotgun sequence	Uncharacterised	1								NZ_JADZGI010000001.1.region001.gbk_region_1	Uncharacterised
GCF_015865035.1_genomic	NZ_JADZGI010000001.1	2	1803338	1830689	FALSE	sphingomonadales_eps				NZ_JADZGI010000001.1 Novosphingobium aureum strain YJ-S2-02 NODE_1_length_2857627_cov_53.530272, whole genome shotgun sequence	NA									NZ_JADZGI010000001.1.region002.gbk_region_1	sphingomonadales_eps
GCF_015865035.1_genomic	NZ_JADZGI010000001.1	3	2570999	2629805	FALSE	putative_wzy_dependent				NZ_JADZGI010000001.1 Novosphingobium aureum strain YJ-S2-02 NODE_1_length_2857627_cov_53.530272, whole genome shotgun sequence	Uncharacterised	1								NZ_JADZGI010000001.1.region003.gbk_region_1	Uncharacterised
GCF_015865035.1_genomic	NZ_JADZGI010000002.1	1	41020	90902	FALSE	putative_wzy_dependent				NZ_JADZGI010000002.1 Novosphingobium aureum strain YJ-S2-02 NODE_2_length_537087_cov_54.804188, whole genome shotgun sequence	Uncharacterised	1								NZ_JADZGI010000002.1.region001.gbk_region_1	Uncharacterised
GCF_015865035.1_genomic	NZ_JADZGI010000002.1	2	454797	497477	FALSE	putative_wzy_dependent				NZ_JADZGI010000002.1 Novosphingobium aureum strain YJ-S2-02 NODE_2_length_537087_cov_54.804188, whole genome shotgun sequence	Uncharacterised	1								NZ_JADZGI010000002.1.region002.gbk_region_1	Uncharacterised
GCF_015865035.1_genomic	NZ_JADZGI010000007.1	1	696	46522	TRUE	putative_ABC_dependent				NZ_JADZGI010000007.1 Novosphingobium aureum strain YJ-S2-02 NODE_7_length_46522_cov_54.809204, whole genome shotgun sequence	Uncharacterised	1								NZ_JADZGI010000007.1.region001.gbk_region_1	Uncharacterised
GCF_014334095.1_genomic	NZ_CP060495.1	1	960849	987142	FALSE	sphingomonadales_eps				NZ_CP060495.1 Novosphingopyxis iocasae strain PB63 chromosome, complete genome	NA									NZ_CP060495.1.region001.gbk_region_1	sphingomonadales_eps
GCF_014334095.1_genomic	NZ_CP060495.1	2	1233838	1286952	FALSE	putative_wzy_dependent				NZ_CP060495.1 Novosphingopyxis iocasae strain PB63 chromosome, complete genome	Uncharacterised	1								NZ_CP060495.1.region002.gbk_region_1	Uncharacterised
GCF_014334095.1_genomic	NZ_CP060495.1	3	1931394	1956534	FALSE	putative_wzy_dependent				NZ_CP060495.1 Novosphingopyxis iocasae strain PB63 chromosome, complete genome	Uncharacterised	1								NZ_CP060495.1.region003.gbk_region_1	Uncharacterised
GCF_001563265.1_genomic	NZ_CP005083.1	1	1288720	1326154	FALSE	putative_ABC_dependent_NO_OPX				NZ_CP005083.1 Sphingobium sp. TKS chromosome 1, complete sequence	Uncharacterised	1								NZ_CP005083.1.region001.gbk_region_1	Uncharacterised
GCF_001563265.1_genomic	NZ_CP005083.1	2	1652295	1678783	FALSE	sphingomonadales_eps				NZ_CP005083.1 Sphingobium sp. TKS chromosome 1, complete sequence	NA									NZ_CP005083.1.region002.gbk_region_1	sphingomonadales_eps
GCF_001563265.1_genomic	NZ_CP005083.1	3	1874385	1927383	FALSE	putative_ABC_dependent				NZ_CP005083.1 Sphingobium sp. TKS chromosome 1, complete sequence	Uncharacterised	1								NZ_CP005083.1.region003.gbk_region_1	Uncharacterised
GCF_001563265.1_genomic	NZ_CP005083.1	4	2729433	2756745	FALSE	putative_wzy_dependent				NZ_CP005083.1 Sphingobium sp. TKS chromosome 1, complete sequence	Uncharacterised	1								NZ_CP005083.1.region004.gbk_region_1	Uncharacterised
GCF_001563265.1_genomic	NZ_CP005083.1	5	4188684	4223721	FALSE	putative_wzy_dependent				NZ_CP005083.1 Sphingobium sp. TKS chromosome 1, complete sequence	Uncharacterised	1								NZ_CP005083.1.region005.gbk_region_1	Uncharacterised
GCF_001563265.1_genomic	NZ_CP005084.1	1	72960	92103	FALSE	putative_wzy_dependent				NZ_CP005084.1 Sphingobium sp. TKS chromosome 2, complete sequence	Uncharacterised	1								NZ_CP005084.1.region001.gbk_region_1	Uncharacterised
GCF_001563265.1_genomic	NZ_CP005085.1	1	91765	130654	FALSE	putative_wzy_dependent				NZ_CP005085.1 Sphingobium sp. TKS plasmid pTK1, complete sequence	Uncharacterised	1								NZ_CP005085.1.region001.gbk_region_1	Uncharacterised
GCF_025574465.1_genomic	NZ_JAOBPP010000020.1	1	288743	319408	FALSE	putative_ABC_dependent				NZ_JAOBPP010000020.1 Kordiimonas aestuarii strain JCM 17742 SW46_2_666605, whole genome shotgun sequence	Uncharacterised	1								NZ_JAOBPP010000020.1.region001.gbk_region_1	Uncharacterised
GCF_014194975.1_genomic	NZ_JACIAY010000004.1	1	248252	270888	FALSE	putative_ABC_or_wzy_dependent				NZ_JACIAY010000004.1 Sphingomonas sp. BK580 Ga0365309_04, whole genome shotgun sequence	Uncharacterised	1								NZ_JACIAY010000004.1.region001.gbk_region_1	Uncharacterised
GCF_014194975.1_genomic	NZ_JACIAY010000005.1	1	271550	301285	TRUE	putative_wzy_dependent				NZ_JACIAY010000005.1 Sphingomonas sp. BK580 Ga0365309_05, whole genome shotgun sequence	Uncharacterised	1								NZ_JACIAY010000005.1.region001.gbk_region_1	Uncharacterised
GCF_014194975.1_genomic	NZ_JACIAY010000019.1	1	0	13015	TRUE	putative_wzy_dependent				NZ_JACIAY010000019.1 Sphingomonas sp. BK580 Ga0365309_19, whole genome shotgun sequence	Uncharacterised	1								NZ_JACIAY010000019.1.region001.gbk_region_1	Uncharacterised
GCF_001421355.1_genomic	NZ_LMKC01000003.1	1	325375	357357	FALSE	sphingomonadales_eps				NZ_LMKC01000003.1 Sphingomonas sp. Leaf9 contig_3, whole genome shotgun sequence	NA									NZ_LMKC01000003.1.region001.gbk_region_1	sphingomonadales_eps
GCF_001421355.1_genomic	NZ_LMKC01000005.1	1	114352	159512	FALSE	putative_wzy_dependent				NZ_LMKC01000005.1 Sphingomonas sp. Leaf9 contig_5, whole genome shotgun sequence	Uncharacterised	1								NZ_LMKC01000005.1.region001.gbk_region_1	Uncharacterised
GCF_001421355.1_genomic	NZ_LMKC01000006.1	1	0	14550	TRUE	pel-like				NZ_LMKC01000006.1 Sphingomonas sp. Leaf9 contig_6, whole genome shotgun sequence	Synthase	2								NZ_LMKC01000006.1.region001.gbk_region_1	pel-like
GCF_001421355.1_genomic	NZ_LMKC01000007.1	1	4141	33766	TRUE	putative_wzy_dependent				NZ_LMKC01000007.1 Sphingomonas sp. Leaf9 contig_7, whole genome shotgun sequence	Uncharacterised	1								NZ_LMKC01000007.1.region001.gbk_region_1	Uncharacterised
GCF_018982885.2_genomic	NZ_CP081848.1	1	316804	340025	FALSE	putative_wzy_dependent_NO_OPX				NZ_CP081848.1 Polymorphobacter megasporae strain PAMC 29362 chromosome, complete genome	Uncharacterised	1								NZ_CP081848.1.region001.gbk_region_1	Uncharacterised
GCF_018982885.2_genomic	NZ_CP081848.1	2	1699730	1723183	FALSE	putative_wzy_dependent				NZ_CP081848.1 Polymorphobacter megasporae strain PAMC 29362 chromosome, complete genome	Uncharacterised	1								NZ_CP081848.1.region002.gbk_region_1	Uncharacterised
GCF_018982885.2_genomic	NZ_CP081848.1	3	2880630	2908167	FALSE	putative_wzy_dependent				NZ_CP081848.1 Polymorphobacter megasporae strain PAMC 29362 chromosome, complete genome	Uncharacterised	1								NZ_CP081848.1.region003.gbk_region_1	Uncharacterised
GCA_005518185.1_genomic	RKSN01000001.1	1	1144178	1170572	FALSE	sphingomonadales_eps				RKSN01000001.1 Chakrabartia godavariana strain PRB40 NODE_1_length_1187972_cov_387.994584, whole genome shotgun sequence	NA									RKSN01000001.1.region001.gbk_region_1	sphingomonadales_eps
GCA_005518185.1_genomic	RKSN01000002.1	1	503751	553721	FALSE	putative_wzy_dependent				RKSN01000002.1 Chakrabartia godavariana strain PRB40 NODE_2_length_1026613_cov_405.577364, whole genome shotgun sequence	Uncharacterised	1								RKSN01000002.1.region001.gbk_region_1	Uncharacterised
GCF_014841615.1_genomic	NZ_JACYUG010000013.1	1	89203	107249	TRUE	putative_wzy_dependent				NZ_JACYUG010000013.1 Sphingomonas sp. CFBP 8760 strain CFBP8760 CFBP876013, whole genome shotgun sequence	Uncharacterised	1								NZ_JACYUG010000013.1.region001.gbk_region_1	Uncharacterised
GCF_014841615.1_genomic	NZ_JACYUG010000014.1	1	29472	94925	TRUE	putative_wzy_dependent				NZ_JACYUG010000014.1 Sphingomonas sp. CFBP 8760 strain CFBP8760 CFBP876014, whole genome shotgun sequence	Uncharacterised	1								NZ_JACYUG010000014.1.region001.gbk_region_1	Uncharacterised
GCF_014841615.1_genomic	NZ_JACYUG010000020.1	1	36505	55787	TRUE	pel-like				NZ_JACYUG010000020.1 Sphingomonas sp. CFBP 8760 strain CFBP8760 CFBP876020, whole genome shotgun sequence	Synthase	2								NZ_JACYUG010000020.1.region001.gbk_region_1	pel-like
GCA_022953095.1_genomic	JALJCR010000001.1	1	1336957	1386210	FALSE	putative_wzy_dependent				JALJCR010000001.1 Qipengyuania sp. 127-1 NODE_1, whole genome shotgun sequence	Uncharacterised	1								JALJCR010000001.1.region001.gbk_region_1	Uncharacterised
GCA_022953095.1_genomic	JALJCR010000001.1	2	1536035	1562117	FALSE	sphingomonadales_eps				JALJCR010000001.1 Qipengyuania sp. 127-1 NODE_1, whole genome shotgun sequence	NA									JALJCR010000001.1.region002.gbk_region_1	sphingomonadales_eps
GCA_947495695.1_genomic	CANLZP010000001.1	1	250439	305485	FALSE	putative_wzy_dependent				CANLZP010000001.1 uncultured Erythrobacter sp. isolate 4-1445.fasta genome assembly, contig: NODE_1, whole genome shotgun sequence	Uncharacterised	1								CANLZP010000001.1.region001.gbk_region_1	Uncharacterised
GCA_947495695.1_genomic	CANLZP010000001.1	2	608916	641479	FALSE	putative_wzy_dependent				CANLZP010000001.1 uncultured Erythrobacter sp. isolate 4-1445.fasta genome assembly, contig: NODE_1, whole genome shotgun sequence	Uncharacterised	1								CANLZP010000001.1.region002.gbk_region_1	Uncharacterised
GCF_030866745.1_genomic	NZ_CP133016.1	1	141814	186021	FALSE	putative_wzy_dependent				NZ_CP133016.1 Sphingomonas limnosediminicola strain PT-12 chromosome, complete genome	Uncharacterised	1								NZ_CP133016.1.region001.gbk_region_1	Uncharacterised
GCF_030866745.1_genomic	NZ_CP133016.1	2	210237	227466	FALSE	putative_wzy_dependent				NZ_CP133016.1 Sphingomonas limnosediminicola strain PT-12 chromosome, complete genome	Uncharacterised	1								NZ_CP133016.1.region002.gbk_region_1	Uncharacterised
GCF_030866745.1_genomic	NZ_CP133016.1	3	2299893	2374140	FALSE	putative_wzy_dependent				NZ_CP133016.1 Sphingomonas limnosediminicola strain PT-12 chromosome, complete genome	Uncharacterised	1								NZ_CP133016.1.region003.gbk_region_1	Uncharacterised
GCF_013370205.1_genomic	NZ_JABWGV010000001.1	1	133313	167484	FALSE	putative_wzy_dependent				NZ_JABWGV010000001.1 Actirhodobacter atriluteus strain HHU K3-1 NODE_1_length_1007690_cov_319.289713, whole genome shotgun sequence	Uncharacterised	1								NZ_JABWGV010000001.1.region001.gbk_region_1	Uncharacterised
GCF_013370205.1_genomic	NZ_JABWGV010000002.1	1	3103	38032	TRUE	putative_wzy_dependent_NO_OPX				NZ_JABWGV010000002.1 Actirhodobacter atriluteus strain HHU K3-1 NODE_2_length_676748_cov_341.967670, whole genome shotgun sequence	Uncharacterised	1								NZ_JABWGV010000002.1.region001.gbk_region_1	Uncharacterised
GCF_013370205.1_genomic	NZ_JABWGV010000005.1	1	16018	37638	TRUE	putative_ABC_or_wzy_dependent				NZ_JABWGV010000005.1 Actirhodobacter atriluteus strain HHU K3-1 NODE_5_length_117031_cov_304.998495, whole genome shotgun sequence	Uncharacterised	1								NZ_JABWGV010000005.1.region001.gbk_region_1	Uncharacterised
GCA_030424845.1_genomic	JAUHWC010000008.1	1	0	43398	TRUE	putative_wzy_dependent				JAUHWC010000008.1 MAG: Alphaproteobacteria bacterium isolate 1_bin.9 NODE_312_length_71379_cov_3.048490, whole genome shotgun sequence	Uncharacterised	1								JAUHWC010000008.1.region001.gbk_region_1	Uncharacterised
GCF_900258045.1_genomic	NZ_OGVD01000004.1	1	1063623	1090362	FALSE	sphingomonadales_eps				NZ_OGVD01000004.1 Sphingorhabdus sp. EL138 isolate Sphingorhabdus sp. EL138, whole genome shotgun sequence	NA									NZ_OGVD01000004.1.region001.gbk_region_1	sphingomonadales_eps
GCF_900258045.1_genomic	NZ_OGVD01000003.1	1	68394	92201	FALSE	putative_wzy_dependent				NZ_OGVD01000003.1 Sphingorhabdus sp. EL138 isolate Sphingorhabdus sp. EL138, whole genome shotgun sequence	Uncharacterised	1								NZ_OGVD01000003.1.region001.gbk_region_1	Uncharacterised
GCF_900258045.1_genomic	NZ_OGVD01000001.1	1	387910	427106	FALSE	putative_wzy_dependent				NZ_OGVD01000001.1 Sphingorhabdus sp. EL138 isolate Sphingorhabdus sp. EL138, whole genome shotgun sequence	Uncharacterised	1								NZ_OGVD01000001.1.region001.gbk_region_1	Uncharacterised
GCF_001425385.1_genomic	NZ_LMQO01000001.1	1	995335	1013373	FALSE	cellulose-type-1				NZ_LMQO01000001.1 Sphingomonas sp. Leaf407 contig_1, whole genome shotgun sequence	Synthase	2								NZ_LMQO01000001.1.region001.gbk_region_1	cellulose-type-1
GCF_001425385.1_genomic	NZ_LMQO01000001.1	2	1050664	1082873	FALSE	sphingomonadales_eps				NZ_LMQO01000001.1 Sphingomonas sp. Leaf407 contig_1, whole genome shotgun sequence	NA									NZ_LMQO01000001.1.region002.gbk_region_1	sphingomonadales_eps
GCF_001425385.1_genomic	NZ_LMQO01000002.1	1	477636	496348	FALSE	pel-like				NZ_LMQO01000002.1 Sphingomonas sp. Leaf407 contig_2, whole genome shotgun sequence	Synthase	2								NZ_LMQO01000002.1.region001.gbk_region_1	pel-like
GCF_001425385.1_genomic	NZ_LMQO01000004.1	1	57323	93146	FALSE	putative_wzy_dependent				NZ_LMQO01000004.1 Sphingomonas sp. Leaf407 contig_4, whole genome shotgun sequence	Uncharacterised	1								NZ_LMQO01000004.1.region001.gbk_region_1	Uncharacterised
GCF_001425385.1_genomic	NZ_LMQO01000007.1	1	0	50982	TRUE	putative_wzy_dependent				NZ_LMQO01000007.1 Sphingomonas sp. Leaf407 contig_7, whole genome shotgun sequence	Uncharacterised	1								NZ_LMQO01000007.1.region001.gbk_region_1	Uncharacterised
GCA_022652485.1_genomic	JALCRK010000001.1	1	152045	178646	TRUE	sphingomonadales_eps				JALCRK010000001.1 MAG: Sphingobium sp. isolate UW_MP_SPHING1_2 Ga0455772_0000024, whole genome shotgun sequence	NA									JALCRK010000001.1.region001.gbk_region_1	sphingomonadales_eps
GCA_022652485.1_genomic	JALCRK010000003.1	1	93751	132520	TRUE	putative_wzy_dependent				JALCRK010000003.1 MAG: Sphingobium sp. isolate UW_MP_SPHING1_2 Ga0455772_0000036, whole genome shotgun sequence	Uncharacterised	1								JALCRK010000003.1.region001.gbk_region_1	Uncharacterised
GCA_022652485.1_genomic	JALCRK010000016.1	1	0	24661	TRUE	putative_wzy_dependent_NO_OPX				JALCRK010000016.1 MAG: Sphingobium sp. isolate UW_MP_SPHING1_2 Ga0455772_0000156, whole genome shotgun sequence	Uncharacterised	1								JALCRK010000016.1.region001.gbk_region_1	Uncharacterised
GCF_005503695.1_genomic	NZ_SCMU01000001.1	1	367179	395120	TRUE	putative_wzy_dependent				NZ_SCMU01000001.1 Sphingopyxis sp. 2PD NODE_1_length_395120_cov_20.350796, whole genome shotgun sequence	Uncharacterised	1								NZ_SCMU01000001.1.region001.gbk_region_1	Uncharacterised
GCF_005503695.1_genomic	NZ_SCMU01000029.1	1	0	26459	TRUE	sphingomonadales_eps				NZ_SCMU01000029.1 Sphingopyxis sp. 2PD NODE_29_length_39570_cov_18.200750, whole genome shotgun sequence	NA									NZ_SCMU01000029.1.region001.gbk_region_1	sphingomonadales_eps
GCF_019880555.1_genomic	NZ_JAINVU010000010.1	1	9517	49920	TRUE	putative_wzy_dependent				NZ_JAINVU010000010.1 Hephaestia mangrovi strain CMS5P-6 Scaffold10_1, whole genome shotgun sequence	Uncharacterised	1								NZ_JAINVU010000010.1.region001.gbk_region_1	Uncharacterised
GCF_019880555.1_genomic	NZ_JAINVU010000017.1	1	0	6804	TRUE	putative_ABC_or_wzy_dependent				NZ_JAINVU010000017.1 Hephaestia mangrovi strain CMS5P-6 Scaffold17_1, whole genome shotgun sequence	Uncharacterised	1								NZ_JAINVU010000017.1.region001.gbk_region_1	Uncharacterised
GCF_019880555.1_genomic	NZ_JAINVU010000001.1	1	633277	666453	FALSE	sphingomonadales_eps				NZ_JAINVU010000001.1 Hephaestia mangrovi strain CMS5P-6 Scaffold1_1, whole genome shotgun sequence	NA									NZ_JAINVU010000001.1.region001.gbk_region_1	sphingomonadales_eps
GCF_019880555.1_genomic	NZ_JAINVU010000003.1	1	233960	296766	FALSE	putative_wzy_dependent_NO_OPX				NZ_JAINVU010000003.1 Hephaestia mangrovi strain CMS5P-6 Scaffold3_1, whole genome shotgun sequence	Uncharacterised	1								NZ_JAINVU010000003.1.region001.gbk_region_1	Uncharacterised
GCF_019880555.1_genomic	NZ_JAINVU010000003.1	2	442917	486082	FALSE	putative_wzy_dependent				NZ_JAINVU010000003.1 Hephaestia mangrovi strain CMS5P-6 Scaffold3_1, whole genome shotgun sequence	Uncharacterised	1								NZ_JAINVU010000003.1.region002.gbk_region_1	Uncharacterised
